 pender     carrefourbrasil eu também fiquei puto com essa  essa tv super top por      tava com um bom preço já q de fato ela custava       ai uns dias antes eles me fazem promoção antes da   fraude com preço menor pra depoos vender mais caro  fala sério,2
porra de    que as passagens ficaram mais caras  não é mesmo  latam bra   fraude,2
"eu comprei essa calça esse mês por           agora ela aparece no     com ""desconto"" por           ela estava em promoção e com frete grátis  mas hoje ela tá mais cara que o valor dela normal            é muita cara de pau mds    fraude  sigazattini ",2
o que não estou vendo ninguém falar é a causa dessas pessoas se humilhando   e o mais trágico  é que as vezes fazem isso para matar a vontade de comer algo  que no dia a dia é caro para     dos brasileiros              fraude,2
roubando na cara de pau trouxa é quem compra   fraude,2
  fraude ipad ontem e hoje  qual a necessidade de fazer isso cara   ,2
esperei a     pra comprar algumas passagens áreas  mas por incrível que pareça  estão mais caras dos que nos outros dias  poxa  skyscannerbr  maxmilhas me ajuda ai 😭🥺   fraude   brasil   ,2
nossa   olhando os post da   fraude é muita cara de pau dessas lojas   gente 😱,2
  fraude  cara  o ps  é o maior exemplo da nossa      no inicio do mês ele estava custando      reais  menor preço   a   dias atrás aumentou para      reais  menor preço   e agora      reais  ps  pro ,2
" burgerkingbr  dvddysgirl   fraude detected     obs   a piscadinha😉 significa  ""vai lá e compra mais caro trouxa"" 😂😂😂😂😂😂😂😂😂",2
 shaidersolutt povo mais sem educação cara  ridículos  merecem a   fraude mesmo,2
eu também constatei isso  e muitos produtos não tiveram os preços reduzidos  é   fraude mesmo  na cara dura  ,2
  fraude    pontofrio  cobrando exatamente o mesmo preco da smart tv    da  samsung    se nao for mais caro   ela,2
eeee carrefour do caralho  aumentando o preço da tv cara de pal   fraude ,2
mano so entrar no zoom e ver o histórico de valor dos produtos em cada loja e ces vao ver que é tudo mentira em todo lugar mesmo  brasileiro nao tem vergonha na cara ne   fraude,2
olha a  kabumcombr tirando com nossa cara     fraude   ninjakabum,2
as coisas tao mais caras   fraude,2
nao bastasse os politicos  no brasil ate o comercio te rouba na cara dura           fraude,2
cafeteira expresso philco ontem tava     reais na americanas e hj subiram o preço pra     reais    toma vergonha na cara dona lojas americanas  lojasamericanas   fraude,2
  fraude qual a lógica disso    o celular do ano passado mais caro que o desse ano  ,2
fui deixar pra  comprar o meu celular na    fraude e ele acabou  ficando      reais mais caro  não  poque ainda acredito  no brasil,2
agora tá     reais mais caro do que tava ontem   fraude,2
 claudiodelucca pois é  tenho a leve impressão de que algumas coisas inclusive estão mais caras  esperar pra ver amanhã  mas ta com cara de  fraude outra vez,2
a cara de desespero dos funcionários kkkkk   fraude ,2
 danilo sanches cara  presenciei uma   fraude bizarra da  americanascom o preço aumentou na minha cara    minutos antes das   h na cara de pau,2
o celular apareceu com     reais mais caro que ontem     isso   x no valor       agora só   x no valor        fraude   vejam  ,2
tão jogando o preço dos telefones lá em cima    tava mais barato fora da   fraude chocada na cara de pau ,2
     o dia que o tonto compra achando que é oferta e paga mais caro do que se comprasse durante o ano inteiro    fraude             brasil,2
 americanascom toma vergonha nessa cara de vocês  esses potes estavam        semana passada   fraude ,2
e as casas bahia que ta cobrando iphone mais caro na     do que no dia que eu vi pra comprar   fraude ,2
do que adianta baixar os preços se o frete é mais caro que o produto 🤷🏻‍♂️   das s   fraude,2
"  fraude é a cara do desgoverno bozonazi e seus asseclas  vc minion  que acreditava no dólar a        diga me como se siente  país desmontado  com o real apodrecendo diante de outra moeda em vias de estourar  que é o dólar   ""aii vc torce contra""   torço mesmo  vtnc   ",2
 fraude tu chega na loja com     de desconto  quando tu vai olhar o preço tá mais caro do que tava antes  perdi meu tempo,2
a casas bahia é muito cara de pau  bicho  estava vendendo o iphone xr antes da meia noite por      e tantos  eu decidi esperar pra ver o preço baixava  mas dando meia noite eles aumentaram pra  k    fraude,2
está tudo muito caro  ou eu que estou sem dinheiro pra comprar nada    fraude,2
esperei sexta feira pra comprar um computador vim no carrefour sorocaba achei que teriam preços melhores aqui  sqn  e em várias lojas online descontos ridículos somente a vista se for parcelado produtos mais caros que semana passada   fraude,2
eu esperei dois meses pra comprar um iphone na      resultado  tá     mais caro     fraude  🙄,2
  fraude  olha a castor aí     off de pura falta de vergonha na cara  o preço médios está a direita  ,2
 tozzafla quero compra um produto  mas não estou achando esse desconto da    os produtos estão os mesmos valores ou até mas caro   fraude pura ,2
caralho eu passei a semana inteira olhando os valores do celular e tava até ok ai hoje tá tudo mais caro   fraude,2
  fraude ja deviam saber que       no brasil eh isso   o preço do produto baixa pouquíssimo dias antes e quando chega na sexta volta pro preço original até mais caro  ,2
     e os cara não desistiram ainda de     no brasil    fraude,2
o  magazineluiza dizendo que tem até     de desconto na   fraude   eu acompanhando e pesquisando preços há um tempão e os produtos estão mais caros do que estavam antes dessa palhaçada ,2
 wellisonkerley  siganetshoes    você não falou em   fraude   amado     com o dólar subindo  produtos de marcas estrangeiras ficam mais caros  lei do mercado   não é questão de ser certo ou errado  é ruim para o consumidor  mas não é errado ,2
como pode uma loja que não quer o meu dinheiro  cara eu to tentando gastar a grana que eu não tenho pra pegar hardware e site nao funciona aaaaaaa  kabum      fraude  kabumcombr eu não consigo finalizar a compra,2
por isso minha     eh no saara  olha minha cara de quem vai comprar coisa online com frete maior q a cara    fraude,2
bando de filhos da puta  os cara aumentar os preços e debaixo coloca o mesmo preço antigo e fala que deu desconto  lixo demais   surreal como os cara não joga pra perder     fraude,2
  fraude  é uma vergonha essas lojas vendendo tudo pelo dobro do valor fingindo promoção de        você paga mais caro do que no dia dia   jeitinho brasileiro de se dar bem em encima dos outros nunca morre ,2
dps que a besteira foi feita e muita gente pagou mais caro  vcs querem tentar abafar o grande furo que vcs conseguiram com a mídia coitados  burgerkingbr  mercadopagobr   fraude  mercadopago   brasil ,2
"é impressionante a cara de pau dessas lojas enchendo a tv de propaganda  anunciando preços altos absurdos falando que é     só um idiota acredita nestes ""descontos"" 😁  fraude",2
porém  faltaram algumas e hoje fui comprar  e na     com um super desconto paguei muito mais caro  😐😑   fraude    brasil   vergonha,2
  fraude as lojas americanas realmente não tomam vergonha na cara  há dois dias atrás a pringle’s custava       hoje às véspera da   brasil está em “promoção” por        é só um exemplo mas é o suficiente pra constatar q nada mudou 🤬 ,2
produtos caros e frete um absurdo   fraude,2
 clarobrasil me explica uma coisa a um   atrás      fiz um plano com vocês e hoje          o plano está mais caro   isso e   brasil ou   fraude ,2
seria muito mais bonito se não fizessem essa patifaria  sério as lojas tratando o consumidor como idiota em plena era da internet que em um clique fica gritante a fraude e a cara de pau  naocomprenada   fraude,2
  fraude preço terça feira no site da electrolux e o de hoje       reais mais caro hoje no        electroluxbr ,2
olhei por   minutos    o app do  magazineluiza e já vi que tem coisa mais cara do que quando comprei a uns   meses atrás   fraude,2
tava na   fraude no shopping itaú e  burguerking não tava aceitando quase nenhum códico pq o mercado pago saiu do ar  as lojas tudo caro  tem que ter coragem viu   ,2
ah não mano    os cara vendendo iphone      mais caro hoje do q ontem    hahhahahhahahhahah   fraude,2
fiquei sabendo que a  kabumcombr tirou as opções de frete mais barato e deixou só sedex  no meu carrinho tá gerado mas quem disse que confirma  isso tudo pra fazer eu voltar e trocar pelo frete mais caro né safado    ninjakabum   fraude vamos de   fraude     ano ,2
todas as ofertas que eu vi ontem estão mais caras hoje 🤷🏻‍♂️   fraude,2
 kabumcombr 🤣🤣🤣a    é a   das  s mesmo a maior   fraude de todos os tempos é site que buga é produto que não tem é preço mais caro que antes da    🤣🤣🤣,2
denúncia  nintendo switch tá mais caro agora do que em outros anos  em várias lojas   já o lite está mais barato  porém não muito   fraude,2
 kabumcombr  hugo terreso fiz questão de pagar mais caro e comprar o mesmo produto no concorrente só para n dar dinheiro pra esses mentirosos da  kabumcombr      fraude  lixobum ,2
por isso perdi o tesão pelo futebol  já vi vários dando o sangue pelo time e quando precisa do mínimo  deixam falando  cadê o  flamengo  gabigol  buserbrasil   pra ajudar os caras      fraude  tercadetremurasdv  fakenews  dateruim  datena  cidadealerta ,2
  fraude cara  estou preparado para as decepções,2
olha a falcatrua da  terabyteshop ai  o mesmo computador  dia    de novembro custava            e hoje às vésperas da   fraude ta saindo quase     reais mais caro  não fosse o  bilômetro do mestre  brksedu eu seria mais um a cair no golpe ,2
the walking dead na   fraude 😱  toda essa humilhação pra comprar balas fini e chocolates   vejam no vídeo que tem cidadã que vai gastar muito com remédio e fisioterapia  o barato saiu bem caro ,2
       eu só queria uma tv de     da lg pra assistir naruto  mas antes da      semana passada  ela estava            e aí na     está             que   fraude  é essa  magazineluiza     a gente espera     e fica mais caro ,2
sobre o lance da   fraude   eu tô namorando algumas camas específicas desde o fim do mês passado  e tô de cara em ver que algumas lojas estão realmente subindo o preço sem pudor algum  cama que já esteve por      que eu vi  agora por          tiração né ,2
"o compracerta da  brastemp e  consulbr é roubada  qdo fui comprar a lava louça ela estava       depois me mandavam ""promoção"" igual essa do dia        agora na  fraude do compra certa e brastemp ela está ainda mais cara que na época  e tem trouxa que ainda acredita  ",2
é      mas você ainda vai pagar caro pelo que me fez rs   fraude,2
 redeangeloni participando da  fraude  domingo batedeira planetária         hoje no dia da   quase     reais mais caro  expliquem p mim essa matemática  ,2
única companhia aérea dando desconto de verdade é a azul  e mesmo assim ainda continua tudo caro   fraude,2
  fraude não é novidade  eu tô há um tempinho querendo uma chuteira nova  tenho acompanhado os preços  e adivinha  hoje tá mais caro  do que antes  ,2
to de cara  mobiliando apartamento  achei que teria várias oportunidades e por isso aguardei a   fraude  resultado  uma geladeira de quase   k baixou       mais nada  🤬,2
a cara da  voude   nem arde né ahahahahah   minuto depois de receber o cupom        fraude ,2
de olho na   fraude  minha dica do coração pra todo mundo que pensa em comprar algo na        é sempre comparar os preços no  buscape   acabei de desistir de comprar um headphone da jbl porque vi no histórico de preços que ele tá mais caro agora ,2
 juboladex   math   bom conselho    fraude na cara limpa só por aqui mesmo 🇧🇷,2
minha contribuição é que o angeloni tá passando propaganda na tv com nenhuma alteração real de preços na maior cara de pau   fraude,2
quem mais segurou uma compra pra hoje na esperança de um descontinho e o produto está mais caro   o meu lado economista às vezes briga com o meu ego de consumidor     fraude,2
estou monitorando o preço de um soundbar faz   mês  em diversas lojas  esperei até hoje  hoje  está     reais mais caro    fraude,2
a única coisa que eu queria realmente comprar na   fraude era um nintendo switch  mas ele ta mais caro do que   meses atrás    ,2
todos os celulares que eu tinha opção de comprar estão mais caros hj alguns com     reais a mais e frete de    reais no mínimo isso é uma vergonha pra todas as empresas  não compro pois não compactuo com esse roubo  vou comprar um usado msm        fraude,2
    não funciona pra galera que não pesquisa  tem gente que acompanha preços o ano toda e esse sim sabe o que vai comprar  já quem quer do nada aproveitar o    vai sofrer  pagar caro sem saber  achando que tá barato        fraude,2
fui na  fastshop semana passada e hoje  durante a      o celular ta     reais mas caro hj   fraude,2
 proconrj  proconsc tinha que verificar a pichau um processador que ontem estava mais barato hj está muito mais caro    fraude,2
o povo se matando para pegar as coisas da  fraude e eu chorando pro cara falar que o peixe tava na promoção tb,2
o q ñ vejo são  comentários     o cara tá com uma faca fazendo reféns no  riodejaneiro  mas a culpa é o cidadão de bem ter armas    fraude,2
  fraude e o celular que eu comprei no início do mês que hoje na     ta      mais caro kkkkkkkkkkk,2
êê  magazineluiza  a cara não queima não  a média de preço é menor q o preço da bike   fraude de vocês  e segundo vcs custava           ,2
  fraude  riachuelo     começou na  riachuelo manas  estão tirando uma com a nossa cara  só pode   aloprocon  procon  proconspoficial ainda bem que eu printei    fraudebrasil ,2
eu que fui conferir as  fraude e dei de cara com uma moça que reclamou do preço do fogão mais fragrancia da atlas kkkkkkkkkkkkkkkkkkkk,2
os cara anuncia a promoção mas nem uma filial adere kkkkkkkkkkkkk mcdonald s te de parabéns pela   fraude,2
o  peixeurbano então é um pilantra  o ano td as msm promos c os mesmos precos e tem a cara d pau d continuar c preço igual e falar q é blck    coraagem      fraude,2
eu ia comprar um kit de teclado e mouse gamer semana passada aí anoitei os preços e os produtos que eu queria  porém deixei p  ver os preços na     se haveria alguma promoção  e sem brincadeira eu digo a vocês que ficou mais caro na       fraude,2
"esses pop aqui no brasil já são ridiculamente caros   mesmo com o dólar nas alturas  agora  o preço sempre ficou  a casa dos        sempre   aí vir colocar ""de        por      "" é ridículo   coisadebrasileiro   fraude ",2
eh  fraude que fala   submarino  americanascom  preços hoje mais caros que segunda feira    e nos últimos    dias  piada vcs  ,2
o frete da  magazineluiza tá praticamente mais caro que o produto kkkk     o frete      o produto   fraude,2
parece que a    dopa as pessoas cara     showda            brasil   fraude,2
comprei dia     um tênis hoje ele estava      mais caro   fraude,2
haja óleo de peroba pra essa cara de pau da  mobly br e sua   fraude descaradíssima,2
entrei na americanas despretenciosamente  e de cara eu eu vi o controle ps  q eu comprei por      reais vendendo a        fraude,2
a  saraiva é um exemplo disso  tem a cara de pau de mentir dizendo que o preço é de “yellow  ” sendo que comprei o mesmo livro ha   meses atras com esse mesmo preço  tipo realy bitch    fraude,2
não vi nada com um bom desconto até agora    só rolo de papel higiênico de folha dupla por       mas de resto    tá tudo o mesmo preço e algumas coisas até mais caras    fraude,2
 podeconferir que  flaxcea e qualquer jogo nao emancipa o país   jairbolsonaro com toda sua incompetência nao consegue organizar o país  alguem duvidava   semifinalcantacomigo    lulalivre continua sendo luta inútil    fraude é a cara do brasil  ,2
acabei de encontrar o celular que eu quero me presentear no natal por um preço incrível   to aqui morrendo de medo de ficar mais caro na   fraude 🤣🤣🤣🤣🤣🤣🤣,2
 pender     carrefourbrasil que vergonha carrefour  toma vergonha na cara    fraude,2
"eu vendo ""todo"" o brasil comprando na      exceto ""nós"" aqui do norte     pq só o frete  já é       mais caro do q do produto vendido o ano todo na minha cidade   fraude ",2
aparentemente tudo nessa   fraude teve o seu preço dobrado e depois deram um pequeno desconto  tornando a coisa igual ou mais cara do que era antes ,2
 azulinhasaereas   fraude passagens absurdamente mais caras hoje ,2
  fraude  preço tá caro  não compre  force as lojas a baixarem o preço ,2
ué  canalshoptime aumentou o preço hoje mesmo na cara dura hein kkkkkk   fraude  deolhobook ,2
na     não era pra diminuir o preço  tá tudo mais caro  algo de errado não tá certo  🤔   fraude       ,2
atenção  semana de   fraude começou em são luís    já tem preço quase o dobro do que tava semana passada em algumas lojas    isso é palhaçada    daí  “aplica o desconto” e fica o mesmo preço ou até mais caro do que o normal ,2
  fraude povo brasileiro adora fazer cara de palhaço na frente das loja  se amutuando nas porta leva pra casa um produto nem de longe tá mais barato ,2
"ahahahahha  olha a cara de pau desse  ifood  ""tudo por   real""  mas daí a entrega subiu pra    pila  ahahahahah baita   fraude ",2
nao tem uma loja nesse internet inteira que o preço do xaiomo redmi note   não aumentou  é muita falta de vergonha na cara desse povo mesmo   fraude,2
hj e o dia que as coisas estão mais caras no ano inteiro  nunca vi o preço dos produtos decolarem tanto depois essas lojas reclamam que não vendem nada   fraude,2
a renner não tem vergonha na cara  que desculpa mais esfarrapada  essas etiquetas amarelas estão em produtos  supostamente  em promoção o ano todo  onde tá escrito isso que no caixa tem     de desconto  me poupe  vocês não têm noção    fraude        ,2
  fraude eu olhei o mês inteiro o site da  lojas renner e sei muito bem o que ta e o que não ta  tem coisas que ja eram caras     de desconto não é nada  fora que tao me obrigando a comprar no cartao da loja  ,2
    no uber eats   compre    leve    porém  o   da promoção é mais caro que o   normal    longe de ser o pior do   fraude mas não deixa de ser errado  ,2
    no brasil as coisas ficam mais caras hahahaha vai entender 🤦🏻‍♀️   fraude,2
ontem no site das  americanascom o preço estava um e hoje o preço estava     reais mais caro no valor do notebook   fraude,2
a dúvida meu pai amado  pagar caro ou mais caro   fraude ,2
lembrando que a     é dia     vamos ter cautela e apontar o dedo na hora e cara certa     fraude,2
 thedark     o  burgerkingbr de poá não aceita qr  e o  mcdonalds br de poá não tá liberando os cherseburguer os caras meteram o   fraude  porra agora como q os caras vão enfartar    ,2
gente essa   fraude só vale a pena se vc pesquisar semanas antes e ver que o preço não alterou  pegamos a geladeira que a gente queria assim  pagamos      e pouco pesquisando o mesmo produto em vários sites  se atentem aos fretes tb  podem sair mais caros que o produto  ,2
to de cara com os relatos   fraude,2
eu vendo que o preço do produto na     tá mais caro que mês passado     fraude ,2
nego acreditar em   fraude aqui é pura inocência e odiar o próprio dinheiro   acompanhei o preço de algumas coisas e hoje ta mais caro do que no inicio do mês  não caiam nessa galera  ,2
 gabeegama  nubank cara   ano passado eles aumentaram o meu em      só pra  u curtir a   fraude brasil  ,2
é      mas eu tô pagando caro pelos meus pecados   fraude          ,2
 santosfc po vcs estão de brincadeira com nossa cara   palhaça fazer        mas só com um tamanho de camisa 👏🏻👏🏻👏🏻 parabéns aos envolvidos   fraude na  santos store,2
  fraude comecei a madrugada indo nas americanas pra ver uma fila desproporcional aos descontos   umas   horas de fila pra ganhar     de desconto numa panela sai muito caro  eu pagaria     pra não pegar aquela fila ,2
a cara nem treme ne americanas       no note   sendo que nos outros sites ta tudo      no máximo   fraude ,2
vou eu a única loja que queria ver as roupas na promoção  pois gosto da marca e acho tudo muito caro  além do mais estava de olho numa calça dela  enfim  tinham algumas araras na promoção  mas reservaram tudo de mais feio e empacado pra desconto       fraude,2
colocaram no poder bandidos q desmatam  queimam  milícia  justiça suja corrupta  antipobres  negros  gays  mulheres  incompetentes  resultado taí  mortes no trânsito  tudo  caro  desemprego  tudo pior do q na era dilma    leonardodicaprio   fraude       ُ,2
meu a cara dessas empresas nem arde de tanta mentira de promo falsa          fraude,2
o  mcdonalds não sabe fazer promoção  a loja da av  bady bassitt em rio preto não está aceitando a promoção do  mercadopago  partiu  burgerking            fraude,3
 mcdonalds br de que adianta colocar oferta de o app não abre de jeito nenhum   fraude,3
não sei oque é mais fake meus irmãos ou a   br   fraude ,3
video da fila  mercado pago  mercadopagobr  mercadopago fora do ar no  mcdonalds br   curitiba   a   fraude o mc donald s  shoppingmuller cobrando a maior em curitiba    consumidor lesado na           ,3
  fraude do  mcdonalds br   o dia inteiro e nada funciona  vergonha mc donald s     fraude ,3
vergonha hein  mcdonalds br   cades as promoções   aplicativo não funciona     fraude ,3
pra não deixar meu filho com vontade gastei um pouco a mais do que eu podia por que o  mercadopago me enganou hoje   mercadopagobr  mcdonalds br   brasil  burguerking      fraude ,3
o silêncio do  burgerkingbr  do  mcdonalds br e do  mercadopagobr é ensurdecedor   fraude  mercadopago,3
 mcdonalds br com o aplicativo que sequer abre  enquanto  burgerkingbr fornece seu cupom em segundo  quem será que ganhou essa  ❤️ 👑   fraude  mequi   bk ,3
 mercadopagobr terá que prorrogar a campanha ou creditar o valor equivalente para os usuários do app pelo vexame com o  burgerkingbr e  mcdonalds br    fraude,3
mais uma   fraude mais um dia frustado no  burgerkingbr   no ano retrasado fui comprar baldes de batata e n tinha  neste ano fui comprar a promoção do mercado pago e n tinha   falta de compromisso com os clientes nunca mais compro no  burgerkingbr    partiumc   mcdonalds br,3
ei  mcdonalds br eu queria ter  visto as ofertas  mas como é   fraude o seu aplicativo não abre nem no wi fi    ,3
fiquei   horas no  mcdonalds br e nada  informaram que o  mercadopagobr estava fora   detalhe carreguei o  bilhete unico pelo aplicativo em    segundos   fraude  mercadopago  somostdsidiotas,3
gente o app do  mcdonalds br não tá abrindo pra mim  e eu n consigo pegar os cupons da   brasil  alguém com o mesmo problema       fraude  mcdonalds           ,3
 mcdonalds br  fraude  abriu tarde e  falaram que acabaram todas as promocões   burgueking tava cheio  tava porém  tacaram fogo no parquinho  porque cumpriram o que anunciaram  burgueking,3
 mcdonalds br lança os cupom e magicamente o app não abre  que coisa né     fraude ,3
 pevasconcelos  mercadopago  mercadopagobr participando da   fraude do  mcdonalds br  que vergonha eim       tô achando que o  burgerkingbr não é assim   ,3
 mcdonalds br engraçado divulgarem tanto uma promoção de  fraude e o app cair  os atendentes não saberem orientar e aindar por cima dar como esgotadas as promoções de   reais  ,3
mc fraude  aplicativo desde de manhã cedo assim enquanto o da burger king roda liso   mcdonalds br   fraude  mcdonalds ,3
esse fight deveria durar o ano todo  eu morreria feliz  😂😎  mcdonalds  burgerking  bk    fraude ,3
  fraude  mequi   mcdonalds br  maravilha hein  o app não abre e as pessoas não conseguem os descontos da      vergonhoso ,3
eu to amando a guerra do     entre o  mcdonalds br e o  burgerkingbr   continuem galera  por favor continuem              fraude,3
 mcdonalds br  meu amor a oferta do ifood ta valendo     ou so foi   fraude   ,3
 mcdonalds br e  burgerkingbr competindo pra ver quem engana mais  👏👏👏   fraude,3
todo ano é a mesma   fraude  sai do trampo  busquei a esposa e vim pro  mcdonalds br  e    surpresa  o restaurante não faz parte da promoção   mas tem uma promoção valendo  só que precisa do app do mc donald que está fora do ar   obrigado pela perda de tempo  mcdonalds br,3
"sabia que tinha algo errado naquela promoção ""espetacular"" do bk ""brasil""  na            mais uma "" fraude br""    ",3
  fraude  mcdonalds br da uruguaiana e da rio branco  ambos no rj  não estão aceitando pgto via mercado pago  mais uma vez as empresas mostrando como tirar sarro da cara do consumidor  aguardando o posicionamento do  proconrj,3
o  mercadopago nao funcionando no  mcdonalds br  é a maior fraude da       fraude  showda ,3
 catupiry   mercadopagobr  burguerkingbr  mcdonalds br nada pior q essa   fraude  todo ano a mesma coisa   ,3
  fraude no  mcdonalds br e  mercadopagobr na hora de efetuar a compra os valores mudam  ,3
que boni hein  mcdonalds br   aplicativo fora    bem na hora do almoço    fraude,3
 mcdonalds br além da  fraude da promoção que esgota em minutos  quando acaba a  cocacola br zero  resolve colocar a normal mesmo sem avisar  parabéns em galera  não volto numa loja de vocês tão cedo ,3
