o varejo brasileiro poderia abandonar de vez a ideia de      o povo não suporta mais ser enganado  oferta de ocasião não é       fraude,0
nessa   fraude não tem nada com desconto significativo  tudo enganação,0
 lojas renner       fraude na renner camisas de       por        corre  que coisa feia hein  mentindo para os próprios consumidores       fraude ,0
já começou a promoção engana trouxa   redetelecine por    reais só   meses é conversa  depois volta para    reais    fraude     naosejatrouxa   claro ,0
 lojas renner jeitinho brasileiro de sempre   tá certo    de        por        👍🏻  ficaadica   fraude   ,0
trabalhei em um supermercado grande aqui de minas e esse negócio de     e pura enganação  supondo o preço de um produto e           meses antes eles colocam         no dia eles colocam por         novamente como se tivesse desconto   mas e o preço real    fraude,0
 lojas renner que vergonha heim   fraude kkk,0
que vergonha  lojas renner    fraude ,0
que feio  hein  lojas renner     aproveite a   fraude das lojas renner  blusas de         por         kkkkkkkk   fraude ,0
me ajudem  qual dessas opções vale a pena ser enganado    fraude,0
       é a maior mentira  cdl acha que tem otário aqui  publicidade enganosa descaradamente veiculada pelas rádios e tv   fraude  cdlbh,0
morta com o moço na    falando que o melhor é nem sair de casa  tudo enganação   fraude,0
já começou o    nas lojas  lojas renner   fraude ,0
o procon deveria acabar com essa     aki no brasil é tudo enganação só lesa o consumidor mais desinformado    fraude,0
 alvesluc as esse é um dos vídeos da   fraude da  lojas renner,0
inhaí brasileiro  já foi enganado na  fraude hoje    fraude,0
" lojas renner  tome vergonha  esses dias fui ver o valor do one million e tava      aí agora na ""promoção"" tá de     e pouco por          fraude",0
começou a   fraude e as  lojas renner estão bombando nas promoções     das s            brasil     ,0
 lojas renner que vergonha hein      fraude ,0
eu to chorando de rir com as propagandas enganosas sério  olhem essa tag   fraude,0
 amazonhelp acho que penalizar o vendedor já basta  isso não é flutuação de preço é propaganda enganosa mesmo  o produto nunca foi          continuo acompanhando os preços e tirando prints da tela pra comprovar como td essa propaganda é uma fraude   fraude,0
 cidadaoprimata realmente a  fraude começou agora  esse ano    os descontos sempre eram fantásticos e não havia enganação   ,0
 fernando      fraude que feio  lojas renner ,0
  fraude e esse vestido na renner ,0
  fraude bermuda na renner ontem         hoje         q vigarisse é essa dona  lojas renner   ,0
     e ainda tá caro nem isso vale  quando criança gastei meus únicos dinheirinhos comprando um trakinas de limão achando que minha cabeça ia virar biscoito igual das crianças do comercial e não virou até hoje  propaganda enganosa e o biscoito era horrível 😢   fraude ,0
uma sexta baseada em ver a galera se enganando com a     brasileira  e eu só deitada observando     fraude,0
olha  sinceramente fui em trocentos sites e tá mais pra   fraude  muda esse nome aí lojas br  tá pornográfico ver tanta enganação        ,0
         dica incrível para não ser enganado    prepare se para a   como um profissional           fraude  promobit  linux  freenas  hardware  games  promobitoficial  kabumcombr  terabyteshop  pichauinfo  chipart info ,0
então é essa a sensação de se sentir enganado no dia de hoje  nem a vida me bateu com tanta força    fraude  burgerking,0
senhora dona  americanas de enganar o povo já basta os políticos  não é msm            fraude   ,0
 lojas renner ai ai vou participar da  fraude so no lanche mesmo  vc q lute,0
 pontofrio vocês estão de brinks né  estou monitorando essa maquina desde agosto e esse preço não é desconto    enganação  ok que não tem selo no produto  mas na patrocínio que faz a gente clicar tem bem grande        fraude ,0
amo que agora serei enganada em conjunto com um monte de gente   fraude   ,0
sistema do  mercadopago bufou no brasil e ninguém consegue usar a primo do  bk   nem do  mcdonalds palhaçada ou é propaganda enganosa mesmo   tem q ir em cima de todos eles    fraude,0
na renner o desconto está maravilhoso  de         por          corre    fraude ,0
foi se a época em que eu era enganada em   fraude atrás de celulares  blusinha  dvd meu interesse agora é em eletro domésticos 😂,0
 maqui nobrega 😂😂😂😂😂 vc viu o video da vendedora colando a etiqueta com o mesmo preço na roupa só que na cor laranja  de promoção  😒 dizem que é na renner    fraude,0
coloca aí o  mercadopago e o  burgerking na   fraude   mercadopago te enganou,0
esse é o brasil 🇧🇷    fraude na  lojas renner é isso  ,0
reclamações na          já sobem      diz reclame aqui propaganda enganosa lidera queixas  veja ranking das    empresas mais reclamadas      fraude         reclameaqui  showda   reclamacoes ,0
 proconspoficial posto de combustível do atacadão  sjc está enganando os consumidores  colocando desconto em combustível  o valor do desconto está em letras grandes e visível  porém a informação de que deve ser acima de    litros está em letras minúscula    fraude   sjc,0
"""oi"" não venha me enganar  esse plano já era       muito antes da       fraude ",0
 viciadoemler  siganetshoes infelizmente o comércio não sabe fazer liquidação  acho   horror uma determinada loja fazer os clientes dormirem na porta  e abrir as   da manhã  coitado de quem acredita nela  eu trabalhei   anos nela    fraude total    triste ver gente sendo enganada ,0
 burgerkingbr agora  depois que várias pessoas foram enganadas  piada né kkk   fraude,0
hoje começa a data do ano em que empresas acham que seus clientes são imbecís pra caírem nas suas enganações de descontos    fraude,0
vocês viram o vídeo da renner remarcando a     pro mesmo preço de antes  agora vocês sabem que é tudo assim né  kkkkkkkk      é back fraude      showda    fraude,0
duas horas na fila pra ser enganado dizendo que não tem sistema pra mercado pago 🙄palhaçada   fraude  burgerking  fila  mercadopago foda ,0
mostrem todas as   fraudes mesmo   fraude  tem lojas que enganam ,0
 proconspoficial   se isso aqui não é fraude  eu não sei o que é   kabumcombr enganando o consumidor    fraude ,0
fui ver o preço do iphone     e não tem nenhum por           essa     só me engana  podeconferir   das s   fraude      premiere   ninjakabum ,0
 lojas renner   fraude  q coisa feia      ,0
  fraude n se enganem   ,0
alô  mercadopagobr  burgerkingbr depois de      na fila o caixa me informa que o sistema está inoperante e tenho que pagar o dobro do valor ou não almoçar pq preciso voltar ao trabalho  ótima campanha de enganação de clientes  desinstalando app em               fraude,0
olha ai que beleza a   fraude das  lojas renner   o brasil não é para amadores  ,0
só observando a galera liberal brava por ser enganada pelos empresários por causa da      é isso aí  quanto mais tiram os direitos dos trabalhadores menos eles repassam pro preço final  fica tudo com eles  ou em capital especulativo    fraude,0
 burgerkingbr que mentira     não tá lançado no sistema  os atendentes falam que não tem  somente   por       fraude total  mercadopagobr enganação   ,0
estes canalhas fazem propaganda enganosa e sempre que jogo a verdade nos comentarios  eles deletam o post  não estranhem se o tweet referenciado abaixo não existir mais    fraude ,0
primeira   fraude identificada em criciúma  renner se fudeu  ,0
quer enganar logo a mim  a rainha da memória fotográfica   fraude ,0
 magazineluiza   fraude da  magazineluiza  ainda engana alguém  ,0
o tanto de artistas fazendo propaganda e o povo brasileiro descobrindo que é pura enganação  será se esses artistas não se preocupam com a reputação da carreira  cadê a responsabilidade social  pq noção não tem né   fraude,0
 mvicca  palmeiras palmeiras só vive sendo enganado nessas  fraude,0
mais uma pra twittar sobre a   fraude  não se deixem enganar por um único dia do ano pessoas  panettone custa    reais o ano todo  não é atoa que a gente espera o natal passar pra pagar    viu extra  vai enganar sua tia  ,0
a  lojas renner  tá arrasando muito nas promoções da   fraude     fraude   brasil  showda  ,0
explica pra nós como se chama isso  lojas renner       fraude  ,0
enganação        pensa q o povo é tonto      fraude ,0
    brunareis   fraude só p qm tem mercado pago aff  enganação  esperando a promo dos cupons de vdd,0
      de         por          não me enganarás     fraude,0
que vergonha  lojas como casas bahia aumentando o preço e depois cortando na   fraude     se não quer abrir mão da margem de     de lucro pra     não entra na       empresas fajutas deveriam ser multadas e expostas em massa por tentar enganar o consumidor ,0
 carrefourbrasil é uma enganação    fraude,0
é amanhã ein  magazineluiza  quero tv smart    da samsung por um bom preço  sem enganar a gente que estou pesquisando durante uns   meses o preço         fraude  magazineluiza,0
  fraude entrando no magaluapp e já saindo   preço igual dos outros    msm das empresas   propaganda enganosa    magaluapp com bug vende mais barato ,0
mais uma invenção da   fraude brasil  se monte  se disfarce e engane os pobres ignorantes sem informação  ,0
a     serviu para influenciadores e youtubers fazerem parcerias com as lojas e enganar vocês que são fãs deles  cambadas de trouxas    fraude         ,0
a renner ta uma pechincha     fraude  showda    brasil        ,0
 srthiagomoraes e ai  lojas renner o que me diz dessa   fraude,0
mais uma desculpa esfarrapada das lojas renner  ou seja se o produto está com tal desconto de     o certo não seria colocar o preço de desconto      fraude ,0
"olhei uns troço no começo do mês             olhei o msm negócio hj  ""de        por       ""    fraude   não foi só em um site    pqp gente de marketing  a matéria ""enganar público     e  "" tá surtindo bastante efeito msm",0
o ideal é vcs verem os preços uma semana antes e no dia que começa a      ai vcs vão saber se estão sendo enganados infelizmente a maioria das empresas são desonestas    fraude,0
quem nao quiser ser enganado nessas   fraude  só usar o vigia de preço  tem app pra android e ios  e site no pc e extensão pro navegador  ,0
 pender     carrefourbrasil  lojasamericanas  casasbahia  lojas renner  riachuelo isso quando é desconto né  porque na minha opinião pouca lojas deram descontos de vdd  só hoje fui vitima de duas   fraude só da lojas renner        aqui no brasil é uma vergonha sem tamanho ,0
"aliás    a  netoficial já começou com a enganação  minha esposa recebeu uma promo de bf  se cadastrou   e disseram q tinha q ligar pra confirmar alguns dados   avisei  isso é balela  ñ vai rolar   ligou e deixaram    mins de    no mudo   e ""caiu""  ahhhh a   fraude 🙊🙈🙉",0
nada funciona nessa porra  não saiam da casa de vocês  enganação   mercadopago   fraude  burguerking  mcdonalds,0
tem outro cheiro também    cês tão sentindo  cheiro de gerente da  lojas renner sendo demitido por   fraude   lojasrenner   fraude   brasil,0
recebi um vídeo da  lojas renner que é a tradicional   fraude vendedora colando o novo preço de        em cima do preço antigo de                 no brasil ,0
 lojas renner   fraude te pegou  lojas renner,0
resumo  a    foi criada nos eua pra limpar o estoque de produtos antigos  abrindo as vendas de natal com produtos novos  desconto de verdade  por aqui virou   fraude  oportunidade pra enganar ainda mais o consumidor  a punição  vez ou outra uma multinha   procon,0
 casasbahia  ifood vcs não têm vergonha de enganar co consumidor não       fraude ,0
mercado pago fez a linha gravida de taubaté e enganou todo mundo kkkkkkkk   fraude,0
preparados para a   fraude consumidores enganados   lesados   loja não entrega produto  preços errados  produto de mostruarios    consumidorgov lhe espera galerinha  boas compras   verifiquem as lojas empresa que respeitam e zelam por seus clientes    dicas  ,0
oi   magazineluiza  gastou tanto no show ontem que agora precisa enganar os consumidores dizendo que tá dando desconto num produto que custava mais barato antes da           fraude ,0
isso aí  lojas renner tá fazendo direitinho             fraude  lojasrenner ,0
não vou te enganar  deixei de comprar umas coisas esperando a famigerada        e me deparei com preços de   fraude o tweet é esse e minha trilha sonora é  não era amor  era cilada  cilada     ,0
sabe esses programas de vantagem  de bancos  posto de gasolina e grandes lojas  a única vantagem é para eles  bando de covardes  enganadores    fraude   brasil         euna ,0
este é o        da  voegoloficial é uma   fraude  que vergonha as empresas querer enganar o cliente  teria que ser punida  🇧🇷👊🏻 ,0
  fraude como td no brasil nunca vai mudar  sempre trata se de uma enganação ,0
o brasileiro descobrindo q     é pura enganação  sei q tem exceções     nem tô chocada  pq será   🤔   fraude,0
sites mentirosos que dizem que fazem mas nao fazem a   tal qual a  lojas renner    brasil   fraude  ,0
fui comprar um iphone xr no site das  casasbahia que estava em promoção  eis que na hora de colocar o endereço da entrega  aparece que é impossível entregar no local  e também coloquei no cep do meu pai  que mora em outra cidade   casas bahia enganando o consumidor   fraude ,0
nessa   fraude se lembre de não ser enganado  procure sites de comparações de preço  como  buscape   deumzoom ou vigia de preço ,0
mas gente  isso é crime  😱 alôooo  lojas renner   procon    fraude ,0
empresas deviam terem  vergonha ao ver sua marca associada a fraude   tentando enganar seu maior patrimônio o consumidor    fraude,0
americanas  renner  marisa e magazine luiza enganando td mundo com descontos q n existem   fraude ,0
  fraude  da  lojas renner     seus trouxas  ,0
   ou   fraude   lojas renner respondeu sobre o vídeo onde a colaboradora aparece remarcando produtos de         por          aqui  🤢🤮🤢🤮não apaguem o tuíte ,0
 magazineluiza   fraude kkkkkkk preço tudo normal  vocês enganam ninguém,0
em outros anos a   já impactou as vendas de natal   muito gente vendeu bem em   e perdeu no natal   agora estão insistindo cada vez mais em aumentar os preços e enganar os clientes tudo para lucrar mais     fraude,0
eu sabiaa que não iria dar certo    parabéns mercado pago pela propaganda enganosa     mercadopago   fraude  burguerking  mcdonalds,0
poxa  lren  lojas renner  tinha tanto respeito por você      fraude ,0
  fraude da renner  esse é um dos vídeos ,0
 americanascom gostaria de um posicionamento da empresa  americanascom sobre a propaganda enganosa   mais de         telespectadores ao vivo também foram lesados   propaganda enganosa      das s  showda    fraude ,0
"de        por           kkkkk  promoção  é isso mesmo que você está vendo  ela está ""trocando"" o preço para a      cuidado com a   fraude     não seja enganado  pesquise bem os preços     ficaadica😉… ",0
    no brasil é uma farsa  os preços estão mais altos do que o normal e em algumas lojas continua o mesmo  porém tentando enganar o consumidor     fraude  enganação,0
o vídeo da   fraude da renner viralizou msm amooo o jeito é baixar os preços de verdade  hein dona  lojas renner,0
eu vou comprar é  nada   fraude  esperarei janeiro q abaixa muito tudo  enganação total,0
"não existe     de verdade no brasil muita enganação  muito desconto escrito de           quando na verdade os preços foram elevados semanas antes  depois maquiados sem contar ""pagar para tirar na loja""  né  americanascom   entre outras ""letras miúdas"" foda    fraude",0
"lojas no brasil        a verdade    fraude   chaves  ""todas pessoas enganadas""  ",0
 estevaosalu  matt        mano  ridículo como a renner é filha da puta  comprei uma camisa em outubro por        e na   fraude ela está por        ,0
se vc não quer ser enganado na   fraude  pesquisa porra     te recomendo usar o zoom ,0
parabéns pela foto de um evento que enganou milhões de brasileiros a gastar dinheiro com   fraude me da ate orgulho de ser brasileiro   ,0
que vergonha lojas renner  lojas renner    fraude ,0
 crespa ms e ainda vem me falar que não é   fraude  lojas renner     ,0
esse lojas deveriam ser fechada por engana e humilhar o povão já que o mesmo passa por situações constrangedoras na fila na hora de entrar na loja   isso tudo pra ser enganado   fraude,0
gente  abram o olho o que mais está tendo nessa     é oportunistas  desconfiem de influencers e youtubers falando de promoções  esse povo tem parceria com as lojas para te enganar      fraude       ,0
a  mobly br  ta fazendo cosplay da   fraude das  lojas renner   mesa e cadeiras marcadas como     com o mesmo preço faz meses ,0
preço de passagem na latam antes da              com taxas e   bagagens                com taxa e   bagagens   mas você pode comprar cada mala por       ou seja  total de          acharam que iam me enganar  mores       fraude,0
"brincadeira essa   fraude a chevrolet oferecendo consórcio ""sem juros"" mas com taxa de administração de        pura enganação ",0
depois de tantas coisas compartilhadas sobre as lojas  riachuelo  lojas renner  casasbahia  poderíamos levantar a tag   naoexistenobrasil    fraude,0
uma dica pra quem for comprar algo na        fraude   pesquisem o produto no site do buscapé e vejam o histórico do preço dele nos últimos   meses p ver se real está em promoção ou se é só enganação   ,0
"que papelão hein  lojas renner    lamentável   depois reclamamos dos políticos   um país onde ""todo mundo"" se acha o esperto e tá sempre querendo enganar um otário    future  pro brasil  eternamente  desse jeito     fraude   ",0
mano  essa   fraude tá parando a cidade    muita gente sendo enganada kkk,0
 lojas renner voces sao burros  em pleno       vao tentar enganar as pessoas na caruda assim    arrebentaram com a marca  seus trouxas    esse tipo de canalhice que estamos combatendo em todas as esferas  parabens    vao virar exemplo agora    fraude,0
brasileiro como sempre enganado pela     bk   com  mercadopago fora do ar é providencial né   propaganda enganosa      fraude ,0
 burgerkingbr  burgerkingbr está fazendo o consumidor de palhaço  fui em dois locais diferentes e nenhum aceitou  tenho fotos e vou publicar  locais com todo mundo reclamando  sabem como resolver isso amigos consumidores   bknuncamais  enganação   fraude  bk      golpe ,0
o dia mal começou e eu ja cansei de ser enganada por essa       fraude,0
cuidado com as propagandas do aplicativo da  magazineluiza algumas são propaganda enganosa  aparece um preço e quando vc vai pagar eles modificam o valor     magalu   fraude ,0
que vergonha hein  brastemp   voces sao   fraude   esse produto custa          fora da    e voces dizem q custa          sem o desconto pra ficar no preco normal ou seja  enganado seus clientes ,0
fui no burguer king  burgerkingbr comprar a promoção que foi divulgada a semana toda pra chegar lá e a atendente dizer que o mercado pago não está funcionando       todo mundo na fila foi enganado e ainda pior  eles empurram uma promoção que criaram de   por      fraude,0
 proconspoficial  o  kabumcombr está brincando comigo me mandaram outro e mail  mas eu trabalho no computador e tenho muito tempo livre pra ficar todo dia lembrando o povo de que  kabum não é uma empresa idônea e que faz propaganda enganosa    fraude   frida,0
nunca confiei  não só eles      no brasil é uma farsa    euna   lojas renner   fraude ,0
 lojas renner ainda que isso seja verdade com base no valor original da peça o valor da tarja está errado    fraude   sabe quando vou pisar meus pés na  renner outra vez  nunca,0
não saio de casa pra essa   fraude  pobre brasileiro enganado,0
   ou   fraude    lojas renner vídeo shopping de criciúma gravado ontem         funcionária remarca produto de         para          como assim  ,0
 lojas renner  dizendo que as etiquetas amarela significam desconto de     no caixas mas qd comprei esta peça em setembro não tive desconto não  então conta outra que está não tá colando      fraude ,0
vivemos em um país no qual os fornecedores como a  casasbahia tentam enganar o consumidor  não colocando o preço no produto e colocando um pano preto anunciando um produto de     reais por     falando que está na        fraude,0
acompanhem o histórico de preço dos produtos  em sites como o buscapé  para não serem enganados no dia         fraude,0
enganação     x   alguém conseguiu comprar  promoção bk mercado pago fora do ar  promoçao mentirosa  enganadora  👎🏾👎🏾👎🏾👎🏾          fraude  burguerking  mercadopago,0
todos prontos e conscientes para serem enganados pelo sistema   fraude    leve bastante  ,0
esse ano não serei enganada pela   fraude ,0
só queria dizer que a promoção do  burgerkingbr é mais uma   fraude para enganar os brasileiro    fraude,0
 cvcviagens quase me enganou  no folheto um cruzeiro esta por        vc entra em contato sobe pra mais de       por conta das pequenas taxas    fraude ,0
sempre que vou comprar alguma coisa na renner  riachuelo e   eu olho embaixo da etiqueta  e muitas vezes o valor da promo era maior ou igual o da etiqueta original    fraude ,0
ontem eu iria comprar um celular  observando o histórico de preços percebi que estava muito mais barato em outubro em comparação a data de ontem  da  fraude  como vou dar credibilidade  pra essa data se os preços sobem bem antes pra  enganar a galara depois   ,0
pessoal se matando na  fraude   como e fácil de enganar o povo           sabadodetremurasdv,0
 fraude  zinzanemoda  zinzanebrasil     compro um vestido que supostamente estaria na promoção e quando chego em casa e olho o preço por baixo da etiqueta vermelha é o mesmo que vocês alegaram estar em promoção  inadmissível enganar o consumidor  autua  proconrj  ,0
extra  extra  treze pessoas enganadas      fraude ,0
alô  proconspoficial  propaganda enganosa do  ubereats br    fraude    confiram os seus pedidos  ,0
  fraude não sei pq vejo alguns comentários defendendo  deveria ser crime enganar o consumidor assim  no final das contas as lojas são safadas e qnd o consumidor decide optar pela pirataria ele é o errado né  brasil n tem jeito msm,0
"já achei   fraude no extra  magazine luiza  casas bahia  americanas  todo ano a mesma enganação de por meia dúzia de produtos   chocolate  panela  ferro  em ""promoção""  cadê tv  k  smarts produto bom com desconto igual nos us  palhaçada  engana trouxa",0
olhem a  lojas renner  com a promoção do   fraude camiseta de       por apenas       ,0
e já começam os relatos da   fraude  o caso abaixo é nas  lojas renner  ,0
já foi enganado hj     fraude ,0
 lojas renner  lojas renner sou consumidora assídua de vocês  essas etiquetas amarelas sempre estão na loja com uma ou outra peça  enfim      fraude,0
que feio  hein  pontofrio  americanascom  submarino e  casasbahia    fraude  temos que printar e divulgar todas essas tentativas de enganar os consumidores  quem sabe assim passando vergonha  essas empresas aprendem    fraude  pontofrio  americanas  submarino  casasbahia ,0
no brasil não tem    não  tem só   fraude  a duas semanas comprei pacote de fraldas    uni  por        agora na   fraude a mesma fralda tá        a gente tem que saber os preços das coisas que queremos comprar na     senão somos enganados ,0
outro exemplo da   fraude     dias antes da data o produto estava mais barato    é mto fácil enganar troca no brasil      fraude    ,0
preciso comprar um celular e a  fraude  mostra como brasileiro gosta de ser enganado   samsungbrasil  xiaomibrasil  motorolabr  asusbr  lgdobrasil  máfia descarada ,0
mc donald’s e burger king      nessa   fraude  enganando legal a galera com isso de mercado pago que o sistema cai toda hora  deveria ser feito de outra forma  uma mais eficaz,0
 casasbahia que tipo de propaganda enganosa é essa    comercial na tv  aspirador de pó por          propaganda no site  tbm        cliquei pra comprar             amados          fraude  propaganda ,0
amanhã é o   fraude  é o famoso engana trouxa  muita gente pensa que vai pagar mais barato  isso é só pra endividadar ainda mais o brasileiro mais do que já deve   fraude  quintadetremurasdv,0
e essa   fraude  do mercado rende mais daqui de perto de casa  nem pra enganar direito o cliente escondendo o preço original  ,0
"eu tenho somente dois estados de espírito pra        um é quando eu vejo um desconto muito grande e acho que to sendo enganado  ""golpe    alô procon     fraude""   o outro é quando eu vejo um desconto pequeno e penso ""só isso meu filho  q descontinho mixuruca kkk""",0
não pode dar grandes descontos  mas seja honesto  que seja   reais de desconto  mas não engane ninguém    fraude,0
  fraude  olha o que a loja renner do nações está fazendo pra      de         por apenas         shopping de criciúma   vídeo feito hoje dia       as         lojas renner  proconspoficial   fraude     criciúma ,0
  fraude o país de merda esse   esses lojistas mortos de fome sempre tentando enganar a população fudida    mesmo com varias fontes de pesquisas eles ainda fazem isso     país vira lata,0
 lojas renner conforme o vídeo  o preço é         e com a etiqueta amarela remarcada fica               fraude,0
 brittojr  fraude pura enganação  e o povo ainda acredita ,0
