 uolnoticias   fraude paraguaia  copia barata dos estados unidos  brasil tenta copiar o gringo e nem isso sabem fazer direito ,1
nooh ponto frio e pernambucanas já estão abertas aqui em lafa  coitado dos funcionários   fraude,1
até no joguinho sim city a     é uma fraude  nem isso salva   fraude,1
eu com   reais vendo as promoções da          fraude,1
a  fraude é real acabei de ver a fraude real kkk,1
fica a dica para hoje  grande mestre da economia 🤣           fraude    ,1
a     no brasil é mais um caso de economia comportamental do que de descontos reais    fraude,1
se o povo destrói loja assim  nem compensa fazer   fraude  é prejuízo demais ,1
quarteirão à   real sr mac  aonde  só se for nas redes sociais pq estou desde o início da manhã no ifood e nada     fraude,1
       precisam do histórico de preço de qual produto  é   ou   fraude  ,1
a  amazonbr está na   fraude   ontem            hoje          ,1
tô só por essas   fraude,1
mentira q a tag da  fraude ainda existe,1
cuidado qqe sua    termine em   fraude gerando  hurry   comprei site  viabrasil dia   nov oferta ipad mini  recebi dia seguinte e mail parabéns da compra e ltransportadora  mesmodiacomprei amazon usa capa já chegou dia   ,1
podia ser mais disfarçada   riachuelo  riachuelo      fraude 👀 ,1
o brasil não é para amadores aqui não tem   brasil mas sim   fraude ,1
app não funciona e a promoção não aparece nas buscas   das s   fraude,1
minha ratoeira pegou a  magazineluiza na    fraude utilizando uma extensão no chrome monitores alguns produtos que quero comprar e veja que interessante  um produto que custa          em outubro subiu pra          e agora na   fraude está sendo anunciada a          👏,1
o mínimo que espero do  mercadopagobr é que não cobrem pra transferir   do app de volta pra conta do banco dps dessa   fraude,1
uiii “ fraude”    gente nao posso fazer nada nao guardaram dinheiro e se vcs nao usam do app do  felipeneto que fiscaliza preço  o app nunca me deixou na mao  😂😂😂,1
  fraude confusão  falta de informação  sem sistema  lanches esgotados      bk jacu pêssego    verdadeiro descaso para com os clientes    cadê o  proconspoficial ,1
estava de olho em um telefone que estava      na  americanascom  na hora que eu fui fechar subiram para           fraude canalha é com a  lojasamericanas,1
todo ano a mesma coisa   fraude ,1
nas   fraude nós vestimos preto ,1
ainda n vi uma promoção boa nessa tal de     que ta mais pra   fraude,1
a bf virou uma espécie de  showdosatrasados do enem  kkkk   fraude,1
ainda bem que eu tô sem dinheiro kkk não tem perigo de cair na tentação da   fraude,1
a  submarino fica mandando newsletter pra gente sem valor de produto  melhorem está bosta meus filhos  proconspoficial   fraude,1
“nossa amei esse      tá tudo tão barato  não era esse valor antes”  vendedores     fraude ,1
    não fomos pegos de surpresa  só usaram nossa humanidade contra nós  e assim  nos somos mais permitidos de ter essa condição     fraude   alcolumbreprevaricador   lulabandido   lulabicondenado,1
    desse ano se resume em briga por comida 😂   fraude,1
essa     do méqui e do bk foi mó furada  várias lojas alegando que estão sem sistema  mas provavelmente a demanda saiu fora do planejado aí suspenderam as promoções   fraude  mercadopago,1
o vigia de preço do  felipeneto está desnudando a   fraude de tupinicópolis,1
a verdadeira   fraude ,1
e que tal geral boicotar o     e foder com essas empresas mesquinhas      brasil    fraude,1
e você que foi hoje ao bk ou mc apostando no mercadopago  meus sentimentos   mercadopago   fraude   fraudemercadopago  bk    fraude  mcdonalds   fraude vergonha  burger king raposo tavares ,1
  fraude promete   deathstranding sem veículos  apenas eu e minhas brisa  ,1
 proconrj  proteste  proconspoficial estou só observando alguns lojas subindo o valor dos produtos    será que é a   fraude chegando ,1
  fraude eu digo   vc dizem fraude 😡😡😡 ,1
não deixe de perder    fraude ,1
 folha kkkkkkkkkkkkkkkk leo se fudeu   bolsonaroestamoscontigo    fraude,1
nem perco o meu tempo com essas coisas  sei que tudo é    fraude mesmo,1
gente  tenham respeito e educação com os vendedores no dia de hoje   fraude,1
procurei um colchão inflável na   fraude mas só achei acima de      com frete de      isso que é uma verdadeira frauda no sistema de consumo ,1
essa   fraude enche o saco,1
só vendo as canalhices do      o conceito dela seria vender tudo pela metade do preço para renovar o estoque para o ano seguinte  aqui no brasil são os preços de todos dias  às vezes com acréscimo   absurdo   fraude ,1
 mercadopagobr n funciona em midway mall natal rn    fraude,1
 oshowda  rolando e eu observando as  fraude ,1
olha a  voegoloficial na   fraude aí gente ,1
  fraude  showda   promoção de bagres  ,1
tentei comer hj no almoço não tinha opção vegetariana na promo  tentei comer agora não tinha promo de lanche vegetariano no ifood a   fraude é só pra carnista já que vegetariano vegano nao come só alface,1
estava de olho em uma passagem área há muito tempo e decidi esperar a           a azul deu     de desconto  porém a passagem que custava em média     reais  hoje custa em média     reais  já ouviram falar em   fraude  é isso  ,1
 carla patriciia  naoinviabilize o zoom tem essa opção  ele gera um gráfico com a evolução do preço ao longo dos dias  muito útil em tempos de   fraude   ,1
não se esqueçam de contribuir para o capitalismo no    ou   fraude ,1
calma gente calma não é tudo isso que vocês imaginam   fraude ,1
mano que raiva dessa   fraude ,1
dizer que os resultados da cooperação do mercosul são irrelevantes é um desculpinha pior que certos preços da   fraude  pois é isso mesmo  esse governo e esse ministro são uma fraude  ,1
 catracalivre   quebrandootabu   então     lulalivre  foramelo   fraude ,1
"""amiga ele mudou  eu juro""   fraude ",1
alguém aí sabe dizer um canto com promoção de perfume de verdade esses dias    fraude,1
  fraude no  burgerkingbr  a gente checou e nenhum dos cupons ta valendo só os preços normais,1
será que sou único que não cria expectativas com   fraude,1
sempre disse que era fraude   é um  markinting   propaganda  que convence a grande massa a gastar o que não tem   fazendo mais dividas     fraude,1
   fraude   veja dez pegadinhas comuns na     e fuja delas   fraude ,1
quem disse que eu nao ia aproveitar a  fraude    comprei sete esfihas por   real,1
 nathfinancas avisa geral pra não cair nessa achando que tá economizando      fraude   brasil  timbrasil   itau  ,1
 bielaragaoo fui comprar só o lanche no bk e no mc donald s  mas tava fora do sistema    fraude,1
pra quem quer box de hp  eu já tenho  mas fica a dica  deve durar pouco tempo     fraude      ,1
saí de casa pra comprar cafeteira e fryer mas deu   fraude  nelas   fiz supermercado  comprei não perecíveis com desconto de     a      até porque a cesta básica corre o risco de subir    essa foi minha   brasil,1
mas vcs vieram descobrir isso agr       fraude,1
gente    a dona araujo vendendo o creme da lola por        falando que é     mas na verdade sempre foi         fraude ,1
olha a   fraude da  amazon aí gente    ,1
 burgerkingbr  evestonpaz vcs falaram q seria  x  vai tomar no cu   fraude   fraude   fraude,1
eu  o que você foi comprar na   fraude   brasil   r  orquideas  chocolates  fini e shampoo  amada   h de fila pra isso ,1
os espermatozóides tentando ganhar a corrida           fraude ,1
décimo terceiro caiu    oh  glóriaaaa    partiu   fraude,1
queria tanto um playstation   para jogar o fifa         fraude ,1
fui calcular o frete de uma compra no  magazineluiza deu cento e trinta e sete reais  uma caixa de fralda de bebê    fraude,1
"aí você confia que nos fastfoods a promoção da     vai ser de verdade e paah    "" o sistema está fora do ar""     burgerkingbr vergonha     ainda censuraram o código de pesquisa    fraude total     fraude ",1
 fhenryque de onde eu vou tirar dois mil bicho  isso é   fraude,1
"estão dando tv de   ""  k    eu quero     brasil    fraude",1
vocês aí chorando pela   fraude do mcdonald s e burger king atoa  pega    conto e come um podrão na rua que é bem mais gostoso,1
 caradossports tem muita coisa boa  exemplo promobit  e muito mecanismo para cair em picaretagem  como o histórico de preço do zoom   quem generaliza que tudo hoje em dia é  fraude é preguiçoso ,1
residencial fechado alto padrão                 despedidadogugu   fraude         imoveisdeluxo  운명을 믿어 우리를 믿어 ,1
note por       no carrefour  com pagto em  x no cartão ou no boleto  o problema é que na hora de pagar o valor muda sem nenhum aviso   é   fraude  carrefourgroup   prefiro pensar que é só um erro no site  vida que segue      brasil   carrefour ,1
estamos de olho 👁   fraude,1
e essa   fraude hein    conglomerados de lojas fazendo firulas na internet e tv  descontos que não existem  produtos que não mudaram de preço    e mesmo assim o povo compra achando que tá barato   ,1
 inessinham  hurbbrasil concordo com vc   e essas dicas de m      afffff  fraude,1
oshi eu fui na casa de   real aproveitar a       cheguei lá tava tudo por    centavos eu hien kaksksk   fraude,1
" japadobolso   º bolsa família    fraude = estouro de ""pobraiada""",1
bem que a bighit podia colocar os ingressos dos shows do bts na   fraude    ingressos por         igual o mcdonalds e bk,1
não sei por que ainda tem gente que se anima com     no brasil    fraude,1
que goras que começa a pingar oferta da   fraude  pq até agora nada de verdade    ,1
 kabumcombr o app ta cheio de bug   não consigo comprar    fraude,1
o realme x   gb    gb sairia com frete por           hoje está saindo por mais de          contando o frete  parabéns  banggood porque noção vocês não tem   banggoodbr      fraude,1
época de   fraude vem que eu quero você e sua amiga,1
 mercadopago fez a desgraça nessa   fraude desinstalar e dar   estrela ,1
tô só esperando essa      fraude,1
o melhor da     é o brasileiro gente      fraude,1
 anjomau    casasbahia  siganetshoes  carrefourbrasil  amazonbr  magazineluiza kabum também não fica atras na   fraude infelizmente ,1
o produto que eu queria ver no      a thread             fraude ,1
começou a  fraude    ,1
tô ansioso com a minha próxima aquisição  e não é da   fraude,1
resposta é que estão aprimorando o sistema  mas até o momento não resolveram nada e o preço nunca mais voltou aos      aquela sensação de   fraude no ar  isso quase uma semana atrás  quero ver no dia  sexta mesmo         acho que não hein  ,1
to duro que nem coco pra essa  fraude  nem casquinha do mc vo aproveitar pprt  ,1
    serve para      comprar o que vocês não precisa   com o dinheiro que não tem   com descontos que não existem          fraude  brasil,1
tão achando que vai ser de graça assim né 😂🤦🏻‍♂️   fraude ,1
tô de olho saraiva  vamos ver esses descontos ai     fraude,1
hoje pedi um  subwaybrasil na   fraude  sem condições  sem recheio  pão duro    fraude,1
meu pai  e essa   fraude   brasil sendo brasil ,1
primeiro acusou os índios de incendiarem a floresta  depois culpou a própria natureza  depois culpou o pt  depois culpou os ativistas de ong s    agora a culpa é do dicaprio     fraude,1
vai toma no cu burguer king   fraude,1
ver a galera desmascarando as safadezas de lojas grandes não tem preço  vergonha viu comerciantes    fraude,1
nunca vi nilópolis tão tumultuada quanto hoje    🤦🏻‍♀️   das s   fraude               brasil  rjtv  riodejaneiro,1
"socos  pontapés  gravatas  dentro das lojas na   fraude brasileira é sinal de recuperação da economia ou desespero de quem teve sua renda reduzida drasticamente   esperando a análise dos ""economistas"" da  globonews  ",1
por enquanto  todos os preços que verifiquei  me fazem ter certeza que aqui no brasil temos mesmo é uma   fraude 🧐    fraude   ,1
"próximo ano  magazineluiza  americanascom  casasbahia menos gastos com artistas e ""celebridades""e mais promoção     fraude",1
as empresas hoje   fraude        ,1
comprei um kindle na   fraude  voltar a ler é a meta de     ,1
"acho que deveriam chamar de   freud  em homenagem ao filósofo da frase  ""só sei que nada sei"" ai seria  ""só sei que nada comprei""   fraude",1
a pessoa que me disser que tem   fraude no espaço hering eu vou mandar logo tomar no cu  pq essa semana trabalhei igual uma filha da puta remarcando os preços pra mais baixo e separando as peças por preço nos equipamentos  de             em diante,1
bem isso kkk    brasil   fraude         bk  ,1
 ifuckyourgods eu não  só de ver aquela fila do tamanho do mundo eu desanimei  mas é  fraude pq o bis que devia tá mais barato  tava   reais cada  eu fiquei tipo “i’m a joke for you ”,1
 passageirode a  fabiovilela tentei vários trechos   até que com bom custo   pelo  smilesoficial mas não consigo concluir a compra  assim acaba sendo   fraude,1
a data   de abril poderia ser facilmente transferida pra hoje   fraude,1
é   fraude ou não é   site da  magazineluiza impossível   app nem carrega   ,1
o brasil sem comunismo  sem petismo mas indo para o abismo   faz arminha     fraude ,1
a  fraude é amanhã ,1
  fraude  tem criança aqui caralho  sems  semnetflix quem lambe fone de ouvido istoé waguinho luciano bivar  mercadopago ,1
não é fácil ser empresário  veja como é difícil vender pela internet  comprei um ssd no padrão m   na   fraude  digo         🤣🤣🤣🤣 ,1
otima promoçao um real e um centavo de desconta hahahha  a verdadeira   fraude ,1
 burgerkingbr tão de sacanagem né  agora  muita decepção essa   fraude de vocês ,1
primeira foto tirada ontem e a segunda hoje  vamos ver amanhã    fraude ,1
gente cuidado com a   fraude heinn  tem muita promoção boa  mas tem muita farsa tb,1
fiz um pedido de   real na   fraude do  ifood e cancelaram meu pedido ,1
pode parecer o  twd mas eu tô rindo muito  🤣🤣🤣🤣🤣🤣   brasil    fraude   das s ,1
primeira semana de janeiro gt  gt  gt  gt  gt        fraude,1
entra ano e sai ano e não consigo finalizar uma compra na  fraude da  kabumcombr     quem sabe um dia eles consigam uma estrutura descente ,1
um gif q define as lojas vendo o povo se matar por produtos com msm valor do ano inteiro          fraude ,1
 americanascom sou aquele que espera a   fraude mais de um mês cupom pra comprar tv samsung na americanas compra o prime e quando vai ver   descobre que a americanas não te da nenhum centavo de desconto pra aparelhos samsung ,1
 kabumcombr só observando o povo cair no baite da   fraude,1
pulseira miband   um dia antes da               na promoção           no dia da              na promoção           brasil sendo brasil       fraude       ,1
como assim  como assim dona  cea brasil     isso é uma vergonha  falta de caráter    nojo      fraude  showda  ,1
  fraude ps  pro     b por       😂😂😂😂🤣🤣🤣🤣,1
 reclameaqui  americanascom já começaram a fazer   fraude neh  americanascom   cadê o meu produto  comprei  esperei o prazo e não recebi nada e nem tem previsão de entrega  obrigado por me lembrar que a   fraude existe no brasil ,1
melhor app pra ficar de olho naquele produto que vc tá afim de comprar na      ele te mostra o histórico de preço do produto  te avisa se o preço tá bacana  recomendo  👍      fraude ,1
não acredito que a  magazineluiza entrou na   fraude era a minha última esperança  já tinha até baixado o app  que vergonha,1
das poucas pesquisas que fiz nas lojas que promovem a      poucas tinham preços realmente promocional  e nenhuma delas uma promoção que fizesse jus ao nome    fraude,1
é uma propaganda de     mais sem vergonha que a outra    fraude,1
eu espero     todo ano somente pra comer mais por menos no burguer king mc donalds e isso é só o que vale a pena pq o resto sinceramente bote   fraude nisso,1
eu sendo trouxa no circuito brasil china  o produto q ontem custava        hoje tá por         no aliexpress  o china 🇨🇳 aprendeu rápido fazer a gente de trouxa 😂😂😂😂    fraude,1
exaltando a croasonho por ter me permitido almoçar com   real   fraude,1
todo mundo achando vai comprar as coisas mais baratas na  fraude aqui no brasil  só compararem com os preços de     meses atrás e vão ver que apenas uns     dos produtos baixou realmente  o resto é só preço antigo que foram subindo pra dizer que baixaram agora ,1
eu vendo todo mundo indo gastar na   das s e eu sem um real no bolso     das s   fraude     sextadetremurasdv,1
o  precovigia é um víciooooo    fraude real,1
entrei em alguns sites de lojas  mas nenhum esta com      de desconto   fraude,1
amores votem na monique camargo   fraude  vasco   mil  afazenda   ,1
 oleafread kkkkkk é tipo assim a tv ta por      dai chega   fridey vamo botar que era por      e dizer que ta com desconto dai botamos por      kkkkkk   fraude,1
só queria uma promoção de todos os trechos de uber por    nessa      fraude,1
quero um tablet da amazon fire mas parece q não vai rolar promo da   fraude,1
  fraude nem vou falar nada  o comércio de ivicity já diz por si só ,1
 bolsonaro  venha aqui rapidinho saber qm é minoria  amordemãe  leonardodicaprio   fraude       ُ,1
to no site da americanas vendo os produtos que eu queria  tudo no mesmo preço de antes   fraude,1
tmnc  burgerkingbr  um tempão na fila para vcs falarem que o sistemas de vcs caiu e que não tem mais promoção    fraude           mercadopagobr,1
    só presta mesmo pra comer  de resto  é fraude    fraude,1
 pseudokaut ta dificil essa   fraude   mas no histórico dele  em junho ele tava por volta de      e eu não vi 😢,1
foi comprar aquele sonho de consumo na    e caiu na   fraude  🤬  nós preparamos um kit que vai te ajudar a resolver qualquer problema que você tiver nesse fds  só clicar no link e receber o acesso 🚀antecipado🚀 à nossa ferramenta  👉  ,1
só trouxa q acha q está economizando   eles sobem o preço e depois colocam no preço normal e dizem q está na promoção   fraude,1
 halexstroelle caramba  🤦‍♀️🤦‍♀️ acha mesmo que o povo é idiota     fraude   p s  gostei da foto do perfil alexandre rsrsrs,1
"  fraude alguem sabe onde encontro um vectra cd turbo com turbina holset hx     válvula de alívio spa compact  intercooler frontal pressurização em alumínio    "" escape    "" com   abafador jk  pistões iasa   mm  p     cv   bielas k   p     cv  com desconto ",1
  fraude alguém me explica,1
   fraude  não dá pra perder  é de esvaziar o tanque     fraude  bolsonaroéopiordahistória  ascom  mandatopopular ,1
só observando os preços de produtos que eu já queira bem antes e hoje estão a msm coisa e os lojistas colocando como promoção 🙄   fraude,1
 mercadopagobr  burgerkingbr aqui no bk de anápolis   go o aplicativo não funciona     fraude,1
esperei até hoje pra ver se a lava e seca q eu quero caia p r a      e nada   fraude,1
"    chegou e a gente constata aquilo que foi dito no episódio      do podcast do investidor inteligente  a ""  fraude""  imagens gravadas em uma grande loja de roupas         fraude ",1
       me arrumando pro     sem ter   real no bolso 😓   fraude ,1
enquanto isso no brasil rola a   fraude 🤪,1
olha aí a nossa paródia da        se os consumidores se mobilizassem nesse período e recusassem esse tipo de manipulação  os logistas gastariam uma grana com publicidade e não venderiam nada  seria lindo      fraude    brasil   tudopelametadedodobro ,1
socorro o final kkkkkk    fraude   brasil ,1
 mercadopagobr  burgerkingbr que história é essa de aplicativo inoperante    que   fraude é essa ,1
 o antagonista olavo já é uma fraude    fraude pra ele é pinto ,1
os ativistas contra produção e consumo desenfreado mais do q certos e ainda preservando vidas de idiotas consumistas e defensores  mas deixem a bosta rolar  manada ninguém segura  pena é q caos ambiental é p todos  podia ser só na casa deles   fraude       ,1
to muito puta com o extra fazendo   fraude   ,1
boatos que a   fraude vem forte no aliexpress por essas bandas  vão tudo chegar em       sim  mas vou comprar várias tranqueiras ,1
gente que loucura essa na lojas americanas   é     ou   quebra tudo      brasil   fraude     temcriançaaquicaralho,1
"preciso agradecer imensamente as pessoas que participaram da   brasil ou   fraude  na atual situação econômica do país  vocês estão apostando muito alto  e se der ""zebra"" e a lei continuar a mesma daqui   anos o nome sai do spc ",1
  fraude e eu continuo querendo comprar tudo que vejo,1
 kabumcombr mentira  kabumcombr é   fraude     tirei print de sua    ,1
é por esse tipo de coisa  que os comunistas dizem que o capitalismo mata   😆😂😂😂    brasil   fraude ,1
"hey   sonybrasil     é    ou   fraude   spider man game of year edition na psn  navegando pelo console  só é vendido como ""conjunto"" e direto no seu site vocês encaminham para varejistas que não vendem o produto na versão anunciada  🤦🏻‍♂️",1
entrei na  pontofrio pra ver o valor de um celular que custava          uns dias atras e cinco mil reais      vcs ferveram a bateria e tomaram pra me bota um xiaomi mi   a cinco mil reais  c i n c o m i l r e a i s        fraude  ,1
lamentável as lojas americanas através das redes sociais divulgar anúncios falsos  isso induz o consumidor ao erro    lojasamericanas  americanascom tirei print do preço surreal e coloquei a prova o preço real        fraude iphone  s por      reais  kkkkkkkkk ,1
vi gente gastando e ostentando o que diz não ter     e eu não nem pude aproveitar a   fraude de finni de      nas americanas 🤯,1
o capitalismo gera o seu próprio coveiro         fraude             ,1
 helenvalverde não caindo no  fraude ta valendo xd,1
descontão pro final de ano   fraude ,1
gente a   fraude ,1
nada de maneiro pra comprar  sem contar que os preços tá a mesma coisa kkk   fraude,1
impressionante a necessidade do norte e do sul americano em comprar o que não precisa  pra falar pra quem não se importa que tem alguma coisa   fraude         consumismo,1
 burgerkingbr aqui em palmas to nenhum dos   restaurantes vai funcionar a  bk    nem a promo de   por     não entendi essa parte de todo o brasil  e agora que eu coloquei dinheiro nesse app    ta com cheiro   fraude,1
a   fraude no  freefirebr começou  ,1
estou na av  brilhante no bk e o atendente disse que essa loja não está participando da promoção  fiquei muito chateado  pois fiquei constrangido  se não envolve todas as lojas deveria estar no post   burgerkingbr   fraude ,1
como já imaginávamos  não tem nada de bom na        fraude   ,1
enquanto isso a    no brasil        fraude ,1
 brunaferrazzi  opsengordei   neumares  hotisblue  caralho po  tudo isso por uma  fraude    ,1
 burgerkingbr e nunca tem vegetariano      fraude,1
 magazineluiza  americanascom vocês decepcionam muito a gente  poderiam ser honestos nas promoções   decepcao   fraude,1
na   brasil sempre vem o questionamento  é   fraude ou realmente tem descontos de verdade ,1
a gente devia começar a registrar print de pesquisas de preços pra comprovar essas   fraude   tô pesquisando um voo  ida e volta  q ontem dava       hoje tá por       alô   maxmilhas e  azulinhasaereas  tá feio  hein ,1
  fraude é isso ,1
afff que absurdo     nem nossa     é honesta    fraude ,1
 cacauprotasio tem a marca ms  cacau moda no rio e  pelo instagram  comprar e enchê la de dinheiro é uma bela resposta a esses desgraçados     fraude  riodejaneiro  cacau ,1
 malumaldita  gaabialthoff sim        todos os dias     reais                você quer  fraude ,1
essa bf é simplesmente uma farsa venho pesquisando   produtos diferentes há tempos e nenhum teve alteração de preço em nenhum site e eu q n me presto a vivenciar isso presencialmente pois sei o caos que é dessas pessoas que juram que estão sendo beneficiadas   fraude ,1
mercado pago fora do ar kkkkkk   fraude no brasil bombando como sempre,1
uma tristeza você querer aproveitar as promoções da     e não ter dinheiro    fraude,1
cuidado com a   fraude    alcolumbre e  maia querem sair de férias sem aprovar a  prisaoem ainstancia  ,1
 samsclubbrasil aderiu à   fraude sabão líquido  produtos de limpeza  azeitona  bolachas com preços do dia a dia ,1
comprei minha tv no início do mês por um valor menor do que qualquer “promoção” de hoje    fraude é real,1
ia fazer uma compra aqui na  fraude  dizia q parcelava em  x   e na qnd coloquei o cartão não deixou parcelar  só em uma vez  tentei em duas bandeiras diferentes    fraude tóxica do kralho  não comprei,1
aiii meu deus  mais um funko  sai daqui   fraude,1
aproveita que amanhã é     já me pede em namoro        de sua mãe ser minha sogra 🤣🤣🤣🤣  fraude   das s,1
em      consegui comprar meu xbox one com dois controles e   jogos por um preço mt top nas americanas  depois disso o preço disparou e nunca mais voltou pra algum valor sequer próximo do que eu comprei  essa foi a única vez que fiz um bom negócio nesse período    fraude,1
não acho o celular que eu quero na promoção em lugar nenhum  realmente uma  fraude,1
  fraude não consegui comprar o meu celular  o preço não mudou nada  tô puto   ,1
alguém aí viu promo de bebida na  fraude   se sim manda aiii,1
         fraude   fraudepontofrio  pontofrio   fraudeviavarejo  viavarejo ponto frio subiu os preços de ontem pra hoje  vai entender essa bf ,1
