eu e kinha vendo a  fraude desse brasil,1
felicidade de adulto é comprar  kg de sabão em pó por metade do preço    fraude        ,1
campanha da  smartfit   mês de gratuidade  por alguém que me dê✌🏻   anos    das s  showda           fraude,1
visão aérea do brasil no dia da       fraude ,1
se eu não comprar nada nessa   fraude  vou ter      de desconto  🤔,1
daí a  voegoloficial lança na    passagens de volta a      vamos às regras  tem que voar de fev a jun  não vale carnaval  não vale páscoa nem feriado  não pode voar  ª  não pode voar domingo nem  ª  ou seja  sobrou o que já estaria no menor valor    fraude    🧐,1
  fraude é esses influencer digital  divulgando essa tv da samsung mentindo dizendo que vai comprar mas eles vão é ganhar cachê com isso,1
quando vão entender que     no brasil nunca vai dar certo  kkkkkkk             fraude  ,1
"clente entrando na loja   "" deixa eu ver essa   fraude"" ""é     ou   fraude  ""  eu rindo para o cliente    fraude ",1
  fraude  brastemp  esta lava louças já esteve por           acompanho ela há muito tempo     hoje está assim  de      por          não fode     proconrj  reclameaqui  consumidorgov    brasil ,1
 fraude dando promoção no gole e eu nem tenho dinheiro pra comprar  triste a vida,1
é pedir muito     kd a   fraude de piercing     ,1
como tudo no brasil  mais uma   fraude,1
ansiosa estou pra gastar     fraude,1
 felixerika  wlonghi  burgerkingbr  mercadopagobr eu vi q o extra perto da minha casa participa eu fui lá e não aceitavam mercado pago e a única promoção é  x   eles só falaram q ia   fraude,1
aceitem pessoal     br d verdade é só d comida q vale  resto é tudo   fraude msm  foquem nisso   sextadetremurasdv 🧐 ,1
aprenda a ganhar dinheiro sem sair de casa  acesse o link      brasil  bitcoinbrasil  bitcoincash  bitcoin   fraude ,1
que merda  o app do mcdonald s não tá funcionando  mequi    fraude,1
eu monto pro          com coisas rgbs bem mais pika q essa merda ai  quem compra apple  é burro pra cacete  nmrl     apple   fraude ,1
cheguei aqui na toyota e o corolla não tá custando    reais   fraude,1
lamentável mesmo  vi uma batedeira por        deixei pra comprar na     e estava no valor de     reais  que feio   fraude,1
 fatimabezerra enquanto isso  o seu jair “inaugura” mais uma obra dos governos lula e dilma  só para variar  lógico     fraude   forabolsonaro ,1
do que adianta essa     com o dólar custando        precisa de   fraude não  o próprio governo já se encarregou de fazer isso ,1
trakinas por   reais foi o cúmulo do absurdo kkkkk   fraude ,1
isso virou piada aqui no brasil      fraude,1
 sabyjenn  andre henri   seríssimo   só nas lojas americanas tem a   fraude 🤭,1
aquele sextou com desconto    braquiflaudey  brekeifraudi   fraude ,1
único lugar que é     e não   fraude é na  kabumcombr  já garanti meu ssd m   nvme  😋😋😋😋😋😋😋😋,1
 livupoficial ah gente pelamor    tô tentando comprar mas naquele site de vocês é impossível  você clica no prato pra adicionar no kit e o botão não responde  principalmente para os pratos que eu quero  assim não dá    fraude,1
qdo me perguntam se eu vou comprar alguma coisa nessa   fraude ,1
não é fácil  viver brasil    fraude,1
que filas enormes são essas nessas lojas  os produtos estão custando         besta é quem ainda cai na   fraude,1
e o ifood que bota todas as comidas por   real e bota o frete com o valor da comida   fraude ,1
  fraude eu procurando aqui meus   reais  ,1
e essa cama baú de        mas o frete sai por           como assim  casasbahia   fraude ,1
aaah detalhe  o que está de fato em promoção  ou acabou ou não era de boa qualidade  revoltx   fraude,1
 lojasamericanas incrível desrespeito com o público do shopping butantã    caixas atendendo    fechados e filas de   horas    fraude,1
"  fraude quando na quinta tinha milhares de unidades no estoque e elas ""esgotam"" na   h   da    ",1
revoltado   burguerkingbr  como assim no bk da república não participa plenamente da promoção   fraude ,1
 showda  rolando e eu ganhando ingresso vip para a   fraude da  americanascom  cuidado com as ofertas mirabolantes  a gente só aprende depois que cai no golpe  pqp    ,1
a   fraude começou bem    ,1
a corrupção está no sangue do brasileiro    fraude ,1
 dokivivis entra na tag amiga    fraude,1
"exatamente todos os produtos que acompanhei pra comprar nesta glamurosa sexta de ""promoção"" estão com a mesma porcaria de preço 🤙   fraude eu já falei pra vcs pararem com essa idiotice de achar que copiam norte americanos vamos inventar umas promos decentes e nossas pfvr",1
nem com o fgts liberado vai rolar   egg    fraude ,1
e o preço do s   que começou a subir exponencialmente dos últimos dias pra cá   fraude ,1
o povo quebrou a porta do shopping 😂😂   showda             fraude ,1
que preguiça dessa   fraude xêsus,1
gente  indico o app da  deumzoom pra nao cair na   fraude séeeriooo  to olhando meu celular ja a um tempo e esperando o momento certo  ele é muito bom esse app pra n cair em pegadinha  aaaa e a  nathaliaarcuri indicou tbm ,1
  fraude  proconspoficial diversos produtos com preço abusivo americanas  magalu  casas bahia  essa   nunca ocorreu nesse país  uma vergonha isso ,1
 latam bra  fraude  comprei os pontos e agora não consigo trocar  a passagem aparece na pesquisa  mas na hora de trocar os pontos não funciona  liguei na central e disseram que não há disponibilidade para nenhuma data  mas continua aparecendo na pesquisa    fraude   dayslatam,1
 brun porto  burgerkingbr aaaa entendi    que boxtaaa    não dá pra confiar na     no brasil   fraude,1
gente  a     no brasil é diferente  aqui você perde o desconto      fraude,1
olha a  fraude chegando ,1
 carmemlouren agora ele sabe  kkkkkkk     fraude,1
seria cômico se não fosse trágico       fraude  gilmarmendesimpeachement  stfvergonhanacional  lavajato  lulabandido  lulanacadeia  prisaoemsegundainstanciaja  prisaoem ainstanciaurgente  impeachmenttoffoli ,1
o melhor que vc tem para fazer neste   fraude é guardar o seu dinheiro ,1
queria saber onde estão os          de desconto nessa  fraude   🤷🏾‍♂️,1
querem comprar celular bom a     reais  não fazem pesquisa  não acompanham preço em site confiável e ainda querem reclamar  a     dá sim pra comprar muita coisa com preço ótimo         fraude   ,1
  fraude e eu querendo fugir das armadilhas do capitalismo  porém a loja piticas de marabá tem meu telefone e mandou as fotos da promoção   pqp,1
então além da americanas o  mercadopago  de quebra o  burgerkingbr  também estão na   fraude  país sem lei é isso né gente    fiscalização zero ,1
  fraude  nada mudou,1
eu que tinha planejado aproveitar a promoção da  fraude e comprar umas coisinhas  fail   jesus que vida essa minha em,1
raramente existe     no brasil  o povo tem que ficar de olho e comparar o preço e não comprar por impulso   fraude,1
como estava  como está hoje    fraude  vigiadepreço ,1
que bosta de promoção hein   kmdevantagens    fraude ,1
a   fraude chegou   e você já encontrou outra fraude   ,1
só estou vendo descontos de verdade e frete free na netshoes    o resto é fraude            fraude,1
“não ajunteis para vós tesouros na terra  onde a traça e a ferrugem os consomem  e onde os ladrões roubam  ajuntai para vós tesouros no céu  porque onde estiver o teu tesouro  aí estará também o teu coração ” evangelho de mateus    fraude    ,1
mcdonald’s e burguer king  se é pra fazer uma promoção que não funciona no horário de almoço  não faça    fraude,1
deixei de acreditar na     quando fui na honda ontem e o capacete que eu queria tava          sendo que dois meses atrás tava      e alguma coisa  no fim das contas  paguei         com desconto kkkkkkkkkk   fraude ,1
to amando ver vcs postando as coisas desmascarando as lojas na   fraude,1
amo ver vcs desmacarando as lojas jbsdhhxdnzkdnsi    fraude,1
teve gente que se deu bem nessa     😅😅😅😅          fraude   brasil ,1
acho que sou a única que não comprei nada da   fraude,1
 magazineluiza qual é o selo de quando é  fraude  kkkkkkk,1
carrefour cobrando  mil  o preço mais baixo é      na amazon sendo que uns dias atrás tava              fraude,1
eu nessa   fraude ,1
 submarino reduziu o cash back que estava dando  não era pra ser       em vez disso reduziu     fraude,1
 loureno           fraude mais um pra lista ,1
gente      não é promoção  é queima de estoque  comprar coisa só por que está com desconto  sendo que desconto tem o ano todo  é ser muito trouxa    fraude       ,1
é triste se apropriar de uma tática comercial verdadeira de outro país  pra fazer brasileiro de trouxa   fraude,1
    segue iludindo mais que o seu crush        fraude,1
 samsungbrasil  já fui vitima de um golpe em uma das lojas de vocês   fraude   parabéns samsung perderam um cliente de mais de    anos ,1
estou vendo máquina de lavar e secar roupa nas lojas e todas estão com o preço normal mas daí colocaram que estava em preço de        fraude,1
mentiram o desconto  😠  te cobraram errado 😱  não se preocupa  acesse nossas soluções para a    e processe você mesmo as lojas que fazem   fraude 🚀💲🤑 só acessar 👉  ,1
vai lá trouxa      fraude ,1
  fraude do bozo  bolsominion terá direito a   ovos    da galinha e   do mito para chupar           ,1
"na   fraude ""o que sai mais barato é não comprar nada""   julios",1
" velberan aqui deviam mudar o nome oficial para "" fraude""  dá uma vontade de ir embora desse pais de merda e nunca mais voltar ",1
mais alguém com problemas nas internets   brasil não tem estrutura pra nada gente  nem pra  fraude,1
um notebook há menos de um mes tava de       e agora ta       🤦‍♀️🤦‍♀️🤦‍♀️🤦‍♀️  fraude,1
o site da zara falou que voltaria às   hs com a      já liberou e o blazer que queria fala que nem tem mais em estoque  como é possível  tá me cheirando   fraude,1
 itaucard fez propaganda de resgate de pontos na      fiz o resgate de três podutos  hoje o resgate de dois foi cancelado  que ótimo    fraude,1
só eu não me empolgo com   fraude  ,1
não caiam na   fraude das  lojasamericanas,1
pode botar aí  pior    da história   promoções horrorosas   brasil não sabe participar das coisas  ridículo     fraude,1
começou a época do povo ficar puto   fraude   ,1
tem prosseguimento a promoção que nunca acaba no brasil  a   fraude é mais ou menos nessa pisada aí  ,1
indicam algo bom nessa             fraude   brasil   ,1
sou dessas que nunca acha nada legal na   fraude,1
mais uma vez a   fraude no brasil dando o banho  os produtos de primeira linha  todos os mesmos preços  já os produtos defasados  ponta de estoque  todos com as promoções de sempre   showda    brasil   ,1
vontade de fazer aquilo q começa com s  sentar em um bar e beber     fraude           sexta  sextafire,1
a     no brasil só serve pra comprar comida o resto é tudo   fraude,1
amando a hashtag   fraude,1
"cuidado pessoal  sexta feira é o dia de todo tipo de promoção maluca  mas é só bater o olho você logo percebe que é fraude  tipo ""uma libertadores e dois mundiais""   fraude",1
realmente temos uma sexta feira negra  onde os lojistas nos mete a vara    fraude,1
 siganetshoes o produto não teve estoque zerado  acompanhei a semana inteira  isso é apenas uma “desculpa” por isso que eu prefiro a  centauroesporte que é muito transparente nesse sentindo 😌   fraude   fraude      reclameaqui  proconcarioca  proconrj,1
produtos com preços bons mais o frete pra minha região tá um absurdo  aff   fraude   ,1
    aí e eu com um total de   centavos pra comprar várias coisas   fraude,1
tenho fé q eu vou conseguir comprar um notebook nessa  fraude,1
"  fraude sem querer generalizar  mas boa parte adota essa ""filosofia"" contando com a falta de memória da população  seu consumismo e a famosa lei de gérson do pensar que está levando vantagem  ""nossa  era tanto e tá por tanto vamo levar""      de desconto sobre      de aumento",1
o pessoal tá reclamando da   fraude  mas não é só aqui no brasil não  eu tava há vários dias monitorando algumas páginas nos sites ebay  americano  e aliexpress  chinês  e a picaretagem tá no mesmo nível  dá uma tristeza isso    😢😢😢,1
 ancapzone se desse pra comprar eu até poderia fazer isso   fraude,1
iludida com as promoções que não existem   fraude,1
  fraude não sei se vocês sabem    mas preços variam,1
so cai em   fraude gente ignorante e mal informada  tem zoom  buscapé  reclame aqui     deixa de preguiça e vai pesquisar antes de comprar ,1
queria uma loja p fazer meu   fraude,1
a incrível capacidade que o brasileiro tem de copiar as coisas lá de fora e estragar tudo     fraude,1
 latam bra  fraude  comprei os pontos e agora não consigo trocar  a passagem aparece na pesquisa  mas na hora de trocar os pontos não funciona  liguei na central e disseram que não há disponibilidade para nenhuma data  mas continua aparecendo na pesquisa    fraude   dayslatam,1
 hudsondanilo   dá uma olhada aqui   fraude,1
 burgerkingbr meu almoço saiu por         vão devolver o dinheiro    fraude,1
tá chegandooo      pague   e leve   hahaha    fraude,1
  fraude   qconcursos com apenas     ,1
"gastei um dinheiro que não tinha  mas ""aproveitei"" a   fraude ",1
nao tem porra nenhuma pra comprar   fraude,1
  fraude meus amores ,1
a maldita farça da        fraude     boatarde  quintou ,1
as lojas americanas nunca entram de      então ela está de    fraude,1
esse frete é pra quem mora na lua  magazineluiza  pq eu moro no brasil mesmo   fraude ,1
se tu viu uma fraude na     entra em contato com o procon e não com o twitter      fraude,1
brasileiro eh atraido por anúncio de desconto  pelo menos eh oq algumas lojas acham nessa   fraude       ,1
todo ano é a mesma coisa  um monte de brasileiro reclamando de que os lojistas brasileiros fazem a mesmissima coisa que os lojistas americanos fazem    fraude,1
pelo que estou vendo a        tá sendo mais   fralda     😂😂😂  eu que não quero essa promoção nem tão cedo 😅😅😅   fraude   brasil,1
chocada com as   da   fraude  só golpe,1
o bot pra views meu pai  vou usar fds  vencemos juntos  xboxgamepassultimate   flamengo  gabigordo glee   fraude   associavasco   championsleague   messi   championseleven   ghvip  n   zenol   loona   ,1
chega a ser ridículo os descontos das lojas brasileiras numa           fraude,1
ha ilusão que a     causa nas pessoas é evidente   fraude,1
olha que precinho camarada do frete de uma poltrona de amamentação    fraude ,1
ah tá então vamos de   fraude ,1
isso aí tá mais pra  fraude,1
a loja americanas tá tirando né  tava vendo um mini ps one essa semana tava      e agora na   fraude tá      bglh eh n comprar nada msm,1
  fraude oi  proconspoficial não sei porque  mas as lojas pensam que a gente é otário  olha esse preço do samsung s  gear dois dias antes da      ,1
vamos duplicar o preço pra poder vender pela metade   fraude,1
vai começar o evento mais fomoso do brasil o   fraude    ,1
pelo visto só o burguer king e mc donalds levaram a        a sério  o resto é tudo   fraude,1
já começou 🙄   fraude ,1
só mais essa de   fraude  fui lá no shopping perguntar se os preços dos assessórios baixaram  a moça honestamente disse    tadumesmovalor de ontem ,1
as  casasbahia que tá firme nessa   fraude ,1
 maitealencastro se tiver condições  aproveita a  fraude e já mete mais ram tbm  bota no talo  ai sim vai ficar alguns bons anos sem dor de cabeça  mas do jeito que esse ai ta  com m   já ta otimo  eu queria pra mim,1
ainda não vi uma promoção que preste nessa  fraude,1
o brasileiro só toma no rabo mesmo   ainda acham que o problema do nosso pais são somente os políticos  slk quem puder levar vantagem infelizmente não pensa  x   fraude,1
 hotandperry estive no carrefour da marginal sp sp gt  vinhos que comprei por        estavam no   fraude por        e as pessoas se atropelando e se chingando para comprar  arroz  feijão  batata  macarrão  cebola  carne  oos  incrível  não entraram no   ,1
olha aí o  novomundo na   fraude  pqp ahahaha parabéns pelos    reais de desconto amigos    fraude ,1
me expliquem aí porque as empresas investem milhões em propaganda na     tupiniquim pra venderem produtos abaixo da margem  não tem lógica     é nítido que é  fraude    abram o olho  ,1
 gpabr  familiaextra  procon   fraude  familiaextra extra cheio de produtos e falando que esgotou ,1
chateada pois o carro do ovo não entrou na promoção  a bandeja com    ovos continua   reais              fraude 😠,1
 magazineluiza usar meu cupom ouro nós produtos em promoção      fraude,1
 burgerkingbr no meu aplicativo do mercado pago está falando que as   lojas de jundiaí estão funcionado para o pagamento  como eu resolvo isso em  vc vão fazer a promoção que eu quero em dinheiro vivo    bk    fraude,1
"nem é sexta ainda e não aguento mais essa ""   ""  até farmácia mandando promoção        fraude",1
me adicionem no zipzop eu posto memes e videos de gatos       e sou legal não é   fraude ,1
vai começar a  fraude ,1
  fraude  gt  gt  gt  governo bozo torra reservas ,1
tome cuidado porque o  buscape o  deumzoom e outros diracionadores inclusive o  google colaboram com o   fraude,1
a fila na lojas americanas dá até dó   fraude,1
auge do dia pedir desconto de   fraude pro dentista 😜✌️,1
adoro olhar o gráfico de preços no zoom antes da  fraude  ,1
pensam que as pessoas são trouxas  olhem a explicação    fraude    ,1
 magazineluiza que oferta  o preço caiu pra cima kkkkkkk    fraude ,1
 crespa ms esse áudio da pessoa falando não existe  foi plantado por alguém que tá querendo aparecer    fraude   brasil          ,1
única certeza que tenho da    fraude é que vou trabalhar e não terei money para gastar  obg de nada,1
esse  fraude só atrasa a vida do trabalhador ,1
por isso eu ñ pego meu  tempo indo as lojas porque eu sei que é    fraude,1
pensei que a carne tinha subido pra voltar ao valor normal na      fraude,1
  fraude  uma falsidade ,1
no brasil nada funciona como deveria ser  é governo que nos rouba o ano todo  pagamos um absurdo de impostos sem ter retorno  e quando chega o momento mais esperado do ano que é      somos feitos de trouxas  nada muda e a organização é zero   fraude,1
a verdadeira  fraude hoje  kkkk,1
o preço anterior preço atual  parece brincadeira um negócio desses kkkkkk        fraude   netshoes   siganetshoes ,1
eu coloco os itens que eu quero comprar no carrinho pra ver se atrai o dinheiro  mas eles só ficam por la mesmo      fraude ,1
tenho   reais pr curtir a   fraude  aho que dá,1
 ventobene porque não tem   brasil so tem   fraude  e nos so estamos levando taca nisso  ,1
nada no midway pra comprar aiai   fraude,1
 salgado      looiraadry eu não comprei nada nessa  fraude,1
boa  fraude a todos 😁,1
eu na   fraude ops           kk ,1
brasileiro é uma merda mermão   fraude,1
 isapray   menezespaula   casasbahia   fraude vergonha dms,1
começou a   fraude    de    por   👇🏼 baixadamilgrau  baixada    fraude    ,1
única     verdadeira essa e a do bk    fraude ,1
quem topa fazer um amigo alcoólatra secreto  nos presenteamos com bebidas   lulabandido  lulapreso  quartadetremurasdv  quartairmandadesdv  sdv   fraude,1
o problema do mundo não é o mundo  é o brasileiro     fraude,1
os atrasados do enem não atrasam mais o aniversário do guanabara agora é organizado a   fraude um dia chega lá,1
eu tô sem dinheiro na monday  na tuesday  na wednesday  na thursday e nada vai mudar na         fraude,1
     netoficial fique   dias sem internet na sua casa  precisa nem ligar p  pedir p  ficar sem  netatende  clarobrasil te deixam sem internet p  trabalhar e estudar automaticamente  preciso da p  ra do serviço e nada  sem net dsd sexta de manhã  reclameaqui   fraude,1
vamos ver se aparece um tablet bacana no precinho nessa    e que não seja   fraude,1
é promoção inexistente  mercado pago que não funciona  lanchonete que não abre em aplicativo pra n precisar vender a promoção        espero que o procon ajude o povão ai   fraude,1
e se isso já não fosse um absurdo  os atendentes do  burgerkingbr estão recolhendo as notas fiscais  praticamente arrancada da minha mão  alegando que é para agilizar a entrega do pedido e não devolvem mais  será que isso é medo do  proconspoficial     fraude,1
bolado conseguir compra nada no  fraude,1
promo no  ubereats  em dobro  resolvi pedir no mikshake no  bobsbrasil da freguesia jpa  escrito em dobro ao lado   automaticamente já apareceram os campos para selecionar o  º  escolhi chocolate  e o  º  morango    aguardei  aguardei     só veio o de chocolate    fraude ,1
 vitolifur estive no carrefour da marginal sp sp gt  vinhos que comprei por        estavam no   fraude por        e as pessoas se atropelando e se chingando para comprar  arroz  feijão  batata  macarrão  cebola  carne  oos  incrível  não entraram no   ,1
acordei preparado pra gastar        na   fraude ,1
essa é a realidade pré   fraude ,1
 magazineluiza mesmo assim  já teve promoções melhores que essa  fraude  brasil sendo brasil   😓,1
na moral  vi oferta nenhuma nessa   fraude,1
"o  magazineluiza vendendo os móveis com incríveis ""descontos"" que tinham a um mês atrás quando comprei  hj estão incrivelmente com o dobro do preço e cm descontos aplicados ficando o mesmo preço de um mês atrás    fraude   das s",1
como eu queria comprar alguma coisa  pena que continuar o mesmo valor pra tudo k    fraude ,1
 mercadopago eu nem me preocupei em sair de casa para essa vergonha de      fraude pq sabendo como o  mercadopagobr é uma merda que não funciona   eu mesmo fiz um rango porreta  e muito mais saudável   foda se pode morrer de vez  mercado pago ,1
o   fraude  é o melhor  eita bando de ladrão ,1
é brasil que fala  né    fraude,1
tenho uma proposta pra você  veja o vídeo e saiba qual vai ser   believe me cuz i won’t let you down  awae meeds more seasons melody   fraude    bighitaddsubs  xboxgamepassultimate ,1
  fraude   corinthians mood    paixões   amores  meu soninho de princesa voltou ,1
a  xiaomibrasil divulgando que tem produtos com até     de desconto na     mas quando você vai ver só acha produto com     e eu iludida achando que conseguiria comprar um pocophone a um preço razoável      fraude  vergonha  pegatrouxa,1
vi o vídeo das lojas americanas  do pessoal se embolando pra entrar  todo ano acontece e todo ano é surpreendente   o caos que a   fraude causa  tu vê os vídeos e pensa  sério mesmo ,1
esse     do burger king é uma chacota  a fila simplesmente não anda e só tem uma atendente   fraude,1
e vamos de   fraude voltando pro mesmo preço o notebook preto e subindo pra      o notebook branco ,1
eu ia comprar meu ipad mas a  magazineluiza fez um anúncio falso e ele estava esgotado antes mesmo de entrar no ar  pois é    fraude q fala,1
a notetec é uma das empresas que me decepcionou   fraude,1
essa   nas lojas são tudo  fraude kkkkkkk,1
queria participar mas estou sem verba privada para este evento           fraude,1
aí  skipnho essa é a   fraude no brasil  vergonha alheia  ,1
alguem sabe de alguma farmácia candlestina que envie via correio confiável           sdv   fraude  lulalivre  sdvgeral,1
segunda feira na americana   um dia antes da       fraude  lojasamericanas ,1
o brasileiro reclamando das trapaças dos empresários na     é o mesmo brasileiro que estaria trapaceando se fosse empresário    fraude,1
a única briga que eu queria era das empresas brigando pra poder me contratar 😑   fraude,1
 magazineluiza na história como a pior de todas    já que o super app não funcionou e ninguém conseguia comprar        fraude,1
  fraude nenhuma novidade,1
  fraude pelos nossos comerciantes da pra medir nossos políticos     não sou perfeito tbm não viu    só constatando   ,1
me diga como é que uma loja consegue se manter com os clientes acabando com tudo  é o kit kat de   reais ou lucro de      em cada produto    fraude ,1
 maxmilhas deve ser   fraude     essa passagem de ida estava por     e pouco para duas pessoas   agora vcs me vem com     falando que tem     off kkkkkkkkkkkk vcs são mto ridículos    ,1
queria comprar um celular coloquei no carrinho e quando fui finalizar mudaram o preço e o anuncio  tenho print do anuncio antigo   casasbahia   fraude,1
já viu o novo vídeo do canal  agroderespeito no  youtube  dá um tempin na     ou   fraude para muitos 😅  e vai lá assistir  entre em   agro  agronomia  agricultura ,1
até no   fraude a galera consegue fazer confusão  tava só vendo os vídeos dos barracos  brasileiro faz show em tudo,1
  fraude em uma tentativa desesperada de atrair as pessoas o burguer king e o mercado pago não aguentaram a demanda  perdi muito tempo na fila para me falarem que o sistema do mercado pago parou    ofereceram muito para não entregar nada,1
que palhaçada é essa   ubereats    fraude ,1
eu esperava uma   fraude de todos  menos de você  burgerkingbr,1
putz   a semana toda os sites com desconto  aí chega a    e os preços dobram de valor  parabéns  bela   fraude 👏 ,1
depois de uma semana agitada   sextadetremurasdv         fraude ,1
parabens  amazonbr   fraude  ontem   hoje ,1
de que adianta fazer promoção  burgerkingbr a o  mercadopagobr não consegue cumprir  era pra cobrir afinal está no app vcs alo proconrj     fraude,1
